num,url,title,category,data
0|https://eda.ru/recepty/vypechka-deserty/pashalnyy-kulich-49571|Пасхальный кулич|Ресторан и еда|Классический рецепт, с которого стоит начать освоение куличного дела. Рецепт непростой, в нем много шагов, он потребует времени и терпения, зато и кулич получится идеальным — воздушным, но плотным, сладким, но с цитрусовой ноткой, румяным и солнечным. Главное, найти хороший шафран — помните, он не должен стоить дешево. Ищите шафран иранского производства. Кулич сложный, но очень вкусный.
0|https://eda.ru/recepty/osnovnye-blyuda/kordon-ble-91879|Кордон блю|Ресторан и еда|Замечательное блюдо, которое при всей своей витиеватости совсем несложно осуществить. Чтобы приготовить кордон блю, нужно обладать терпением, так как придется аккуратно разрезать и отбивать куриное филе, и также нужно обладать хорошим куском сыра, который вместе с ветчиной прячется в недрах котлетки. Рецепт этот проверен нами много раз, поэтому также хотим вам посоветовать серьезно отнестись к выбору ветчины — тут ее вкус ощутим.
0|https://eda.ru/recepty/osnovnye-blyuda/amerikanskie-makarony-s-syrom-80535|Американские макароны с сыром|Ресторан и еда|Американские макароны с сыром — это не то, что итальянские или русские макароны с сыром. Это целая запеканка! Можно использовать также рожки, ракушки, пенне — объемную, то есть, пасту.
0|https://eda.ru/recepty/vypechka-deserty/hychiny-s-kartofelem-i-syrom-79773|Хычины с картофелем и сыром|Ресторан и еда|Хычины — балкарское домашнее блюдо — тонкие лепешки с начинкой. Обычно их готовят из пресного теста: вода, мука, соль, — но сейчас делают и из дрожжевого, замешивая его на молоке. Классический рецепт домашних хычинов предполагает начинку из картофеля и сыра, а еще хычины готовят с творогом и зеленью, очень редко — с ливером. Этим рецептом с нами поделилась Елена Карданова, повар московского ресторана «Арагви».
0|https://eda.ru/recepty/osnovnye-blyuda/tradicionnyy-chili-kon-karne-81227|Традиционный чили кон карне|Ресторан и еда|Одно из самых ярких мексикано-техасских блюд. Густая насыщенная каша из красной фасоли, говяжьего фарша и овощного соуса, который сам по себе тянет на отдельное блюдо. Несмотря на всю эту массу ингредиентов и вкусов, готовить чили кон карне очень просто — надо лишь обзавестись вкусными продуктами. В нашем рецепте чили кон карне есть и говяжий фарш с говяжьим бульоном, и несколько видов перца, и сладкая томатная паста, и крепкая красная фасоль. Подавать это замечательное варево хорошо с рисом, с кукурузными чипсами, да и с любым другим мучнисто-крупяным гарниром.
0|https://eda.ru/recepty/zakuski/perci-farshirovannie-kuskusom-20762|Перцы фаршированные кускусом|Ресторан и еда|Перцы, фаршированные кускусом, — это еще один интересный вариант приготовления фаршированных овощей. В отличие от привычной начинки из мяса и риса, в рецепте этого блюда присутствует сыр, а главный герой — кускус — добавляет таким голубцам приятный ореховый привкус. По этому рецепту его не нужно предварительно варить, иначе он станет твердым. Зато перец лучше бланшировать, это позволит ему стать более эластичным и сохранить цвет. Начинка из цукини, лука, сладких черри и петрушки готовится на оливковом масле с добавлением сыра фета. Для большей пикантности его можно заменить на любой сыр с выраженным запахом, например, овечий или козий. С начинкой для фаршированных перцев можно постоянно экспериментировать: заливать крупы грибным бульоном, добавлять мясо, орехи или сухофрукты.
0|https://eda.ru/recepty/osnovnye-blyuda/kurica-s-sousom-iz-jogurta-kunzhutnih-semechek-limona-chesnoka-30677|Курица с соусом из йогурта, кунжутных семечек, лимона и чеснока|Ресторан и еда|Еще один рецепт с йогуртом, но в этом случае его используют в качестве основы для соуса из кунжутных семечек и петрушки. Сами ножки предварительно подмариновывают в смеси соевого соуса и меда.
0|https://eda.ru/recepty/supy/tikvennij-sup-so-vkusom-karri-34537|Тыквенный суп со вкусом карри|Ресторан и еда|Тыква — идеальный спарринг-партнер, она одновременно не изменяет собственному характеру и готова подстроиться под чужую индивидуальную манеру. И в итоге получается не овощное карри, а именно тыквенный суп со вкусом карри. Суп получается ярким на вид и сладким на вкус. Для рецепта лучше всего использовать крупноплодную тыкву. Суп получается ярким на вид и сладким на вкус, а за нежную консистенцию отвечает кокосовое молоко. В самых крайних случаях молоко можно заменить нежирными сливками. Важно, чтобы суп получился густой и не напоминал крем.
0|https://eda.ru/recepty/zakuski/lobio-14593|Лобио|Ресторан и еда|Практически у каждой грузинской хозяйки свой рецепт лобио. Но все же существуют две главные школы: либо готовят кашеобразное лобио из толченой фасоли, либо — густое лобио из цельной. Мы предлагаем вам рецепт, который понравится и нашим и вашим. В Грузии есть специальные заведения, где готовят только лобио — они называются салобио. Недалеко от Тбилиси, под Мцхетой, есть такой ресторан — «Салобио», его все знают. Лобио всегда едят с чем-то кислым. В «Салобио» к нему подают гурийскую капусту, соленый перец, зеленые помидоры и мчади.
0|https://eda.ru/recepty/zavtraki/benediktinskie-yayca-26004|Яйца бенедикт|Ресторан и еда|Яйца Бенедикт — популярный классический завтрак, представляющий собой пшеничную булочку с яйцом-пашот, голландским соусом (взбитой на водяной бане нежной пеной из желтков, сливочного масла и лимонного сока) и обжаренным беконом. Рецепт перешел в мировую кухню из американской, отсюда же традиционная версия рецепта с мясной составляющей. Бенедикт во всех его видах, наверное, самое духоподъемное утреннее блюдо в мире: от одного его вида на душе становится светлее. Кстати, есть такая версия, будто изначально изощриться поваров заставил некий Сэмюэль Бенедикт, нью-йоркский брокер, который искал спасенье от похмелья. От похмелья бенедикт и правда помогает, но еще больше — от тоски по дальним странам и беззаботному отдыху, недаром эти прихотливые яйца ассоциируются прежде всего с пятизвездочными отелями во всех точках мира. В ресторанные меню они тоже попадают нередко: умение повара приготовить безупречный пашот под голландезом поднимает престиж заведения. И не стоит забывать: рецепт яиц бенедикт — конструктор, ингредиенты можно слегка видоизменять, например, вместо булочки можно взять бриошь, готовый круассан или и вовсе тост, вместо бекона добавить красную рыбу, и все это украсить охапкой зеленого салата. Главное в традиционном рецепте бенедиктинских яиц — сочетание яйца пашот и насыщенного голландского соуса. Эти два ингредиента, в отличие от всех остальных, должны быть константами. Мы приготовили рецепт яиц бенедикт для дома: с покупными круассанами.
0|https://eda.ru/recepty/zakuski/pashtet-iz-kurinoj-pecheni-s-portvejnom-22099|Паштет из куриной печени с портвейном|Ресторан и еда|Необычный паштет из куриной печени с портвейном имеет сладковатый и одновременно пикантный вкус. Эта закуска отлично подойдет для торжественного вечера или праздничного ужина из нескольких блюд. Портвейн добавляет субпродукту игривую и дерзкую ноту — пряный аромат представляет привычную куриную печень совсем в другом свете. Чтобы его подчеркнуть, в этом рецепте в паштет добавляется мускатный орех и майоран. Паштет с портвейном получается по вкусам и запахам настолько привлекательным, что его тут же хочется намазать на хлеб — обязательно свежий и обязательно с орехами. Секрет однородной консистенции в правильном добавлении сливочного масла. Оно должно быть комнатной температуры, но не растопленное в микроволновке или на водяной бане до жидкого состояния, иначе масло крупинками застынет в паштете.
0|https://eda.ru/recepty/zavtraki/pshennaya-molochnaya-kasha-s-tykvoy-15110|Пшенная молочная каша с тыквой|Ресторан и еда|В русской кухне сочетание пшенки с тыквой — самое что ни на есть традиционное. Если сначала отварить тыкву в молоке, а лишь затем забросить туда пшенку, у каши появится особенный сливочный оттенок. А если дать постоять готовой каше в медленно остывающей духовке, то она получится еще и разваристой, и нежной, и пуховой. И при этом такой рыжей, что от одного ее вида даже в хмурый день на душе становится теплее.
0|https://eda.ru/recepty/osnovnye-blyuda/govjadina-s-ustrichnim-sousom-36638|Говядина с устричным соусом|Ресторан и еда|Говядина в устричном соусе — типичное для Юго-Восточной Азии блюдо. Готовить его лучше всего, разумеется, в воке, соблюдая все правила: тонко нарезанные мясо и овощи быстро обжариваются на сильном огне. Соцветия брокколи удаются особенно хорошо — они остаются хрустящими и яркими. Входящий в рецепт устричный соус видом напоминает соевый, но он гораздо более насыщенный на вкус. Делают его из устричного экстракта, крахмала и сахара: китайские хозяйки делают его сами, но проще купить готовым, конечно.
0|https://eda.ru/recepty/zakuski/suluguni-zharennij-s-pomidorami-32771|Сулугуни, жаренный с помидорами|Ресторан и еда|Сулугуни, жаренный с помидорами, — легкая закуска, приготовление которой займет не более десяти минут. Грузинский сыр сулугуни хорош как сольно, так и в сочетании с овощами. Особенно в горячем виде. При высоких температурах из сыра выкипает молоко, и вкус резко меняется, обретая приятную копченость. Залог успеха — только свежий сыр, который лучше брать на рынке, где можно его попробовать. Молодой сыр скрипит на зубах и по цвету близится к белому. Можно сыр не натирать, а разложить тонкими кружочками поверх помидоров. Если удастся найти настоящий ялтинский лук, сладкий на вкус, лучше использовать его. При других обстоятельствах нарезанный кольцами красный лук перед готовкой следует сначала обдать кипятком, а потом промыть холодной водой.
0|https://eda.ru/recepty/zakuski/baklazhani-zharenie-s-granatom-i-zelenju-19323|Баклажаны жареные с гранатом и зеленью|Ресторан и еда|Грузинская классика, в которой терпкий ядреный вкус баклажана утихомиривается с помощью мягкого гранатового соуса.
0|https://eda.ru/recepty/osnovnye-blyuda/zapechennaja-kurica-s-ovoshhami-17672|Запеченная курица с овощами|Ресторан и еда|Запеченная курица с овощами — классический французский рецепт, который по загадочной привычке давать блюдам не имеющие особого отношения к делу географические имена сами французы называют английским. Тем не менее, это один из самых популярных и простых рецептов с использованием духовки. Особую роль стоит уделить сливочному маслу — его не должно быть мало, чтобы птица не получилась сухой, ведь вся прелесть блюда должна состоять из хрустящей корочки снаружи и нежнейшего мяса внутри.
0|https://eda.ru/recepty/vypechka-deserty/zaher-52967|Захер|Ресторан и еда|«Захер» — десерт, который получил свое название (как и многие другие блюда в то время) по фамилии создателя — кондитера Эдуарда Захера. Австрийский Sachertorte часто путают с «Прагой», но последний был придуман в советское время по аналогии, а назвали его так, вероятнее всего, потому что подали впервые в одноименном московском ресторане. Оригинальный «Захер» (есть и множество других версий) имеет две прослойки абрикосового конфитюра и заливается глазурью из черного шоколада. Верх бисквита обязательно срезается, чтобы поверхность торта была ровной.
0|https://eda.ru/recepty/salaty/salat-iz-pecheni-treski-i-yaic-58266|Салат из печени трески и яиц|Ресторан и еда|Сегодня не обязательно идти на рынок в рыбный отдел, печень можно купить в обычном супермаркете в жестяной банке. Салат из печени трески готовится без заправки. Сдобрить оливковым маслом можно, но не обязательно. Печень и так богата полезными жирами. Готовится салат проще простого — ингредиенты перетираются и смешиваются, образуя легкий паштет. Можно отправить печень в мясорубку или блендер, чтобы достичь кремообразной консистенции. Если хочется именно салата, добавьте вареный рис или картофель.
0|https://eda.ru/recepty/vypechka-deserty/klassicheskoe-krem-brjule-s-madagaskarskoj-vanilju-23817|Классическое крем-брюле с мадагаскарской ванилью|Ресторан и еда|Одна из самых притягательных поверхностей — ломкая карамельная корочка на крем-брюле. А сливочный пудинг, который хранит эта хрупкая броня, — лучшая компания для клубники, малины, смородины и прочих свежих ягод. Раскрыть тайны твердой корочки сверху и черных ванильных точек внутри нам помог соучредитель ресторана Carré Blanc повар Эрик Ле Прово.
0|https://eda.ru/recepty/supy/lohikeytto-92772|Финский рыбный суп лохикейтто|Ресторан и еда|Лохикейтто — финский сливочный суп с лососем. Название не таит в себе подводных камней: в переводе с финского lohi означает лосось. Чтобы приготовить классический лохикейтто, понадобится полкило лосося, литр жирных сливок и много укропа — наваристая, калорийная и очень вкусная похлебка, которая согреет в холодную северную ночь.
0|https://eda.ru/recepty/osnovnye-blyuda/kurica-teriyaki-125574|Курица терияки|Ресторан и еда|Терияки — это традиционная японская техника, обжаривание с глазированием: «тери» — это «блеск», а «яки» — «жарить». Продукт в итоге должен приобрести карамельный блеск, который дает ему маринад из соевого соуса, саке (или мирина) и сахара. Для простоты можно использовать магазинный соус терияки — это специальный соус для техники терияки, в который уже входят все нужные ингредиенты. Готовить под таким соусом можно что угодно, мы же предлагаем начать с курицы! Приготовить вкусную курицу по этому простому рецепту — хороший способ разнообразить привычное меню и устроить для домашних ужин в японском стиле.
0|https://eda.ru/recepty/osnovnye-blyuda/ciplenok-s-rozmarinom-43538|Цыпленок с розмарином|Ресторан и еда|Ленивый вариант цыпленка табака — точнее, греческий его вариант. Лень — одно из ключевых морально-волевых качеств этого народа. Она в конечном счете и позволяет ему достигать многих вершин, в том числе кулинарных. Мясо по этому рецепту получается сочным и ароматным, поскольку жарится на большом огне в окружении розмарина и лаврового листа — самых сильных травяных специй. В Греции практически ни одно куриное блюдо не обходится без цитруса. В этом есть доля разумного: лимонная кислота нейтрализует жирность жареной корочки цыпленка. В лимонный соус, оставшийся после жарки мяса, можно всыпать наполовину сваренный рис пилаф, хорошо перемешать и доготовить в духовке.
0|https://eda.ru/recepty/osnovnye-blyuda/vareniki-s-kartoshkoj-i-gribami-41379|Вареники с картошкой и грибами|Ресторан и еда|Вареники с картошкой и грибами — чуть ли не самое главное блюдо домашней кухни. Нам нравится, что вареники можно делать с самыми разными начинками. При этом кому-то в самих картофельных варениках нравится начинка в виде пюре, а кто-то любит остатки твердой картофельной текстуры. Редакция «Еды» склоняется к тому, что можно время от времени просто менять плотность фарша, уважая и ту и другую вариацию тактильных ощущений. А еще вкус картофельных вареников можно разнообразить, добавив жареный бекон или так называемые шкварки.
