num|url|title|category|data
0|site.ru/snacks-23|Сухарики|Ресторан и еда|Взял сухарики и пиво
0|site.ru/snacks-24|Сладкое|Ресторан и еда|Купила сладкого на вечер
0|site.ru/snacks-25|Лимонад|Ресторан и еда|Купил лимонад и орешки
0|site.ru/snacks-26|Пиво|Ресторан и еда|Взял пива на выходные
0|site.ru/snacks-27|Кола|Ресторан и еда|Купил колу и чокопай
0|site.ru/snacks-28|Вино|Ресторан и еда|Взяла красное вино домой
0|site.ru/snacks-29|Батончик|Ресторан и еда|Купил батончик и энергетик
0|site.ru/snacks-30|Снеки|Ресторан и еда|Набрал снеков к сериалу
0|site.ru/snacks-31|Пиво|Ресторан и еда|Взял темное пиво и рыбу
0|site.ru/snacks-32|Конфеты|Ресторан и еда|Купила желейные конфеты
0|site.ru/snacks-33|Энергетик|Ресторан и еда|Взял монстр и чипсы
0|site.ru/snacks-34|Чипсы|Ресторан и еда|Купил принглс на вечер
0|site.ru/snacks-35|Шоколад|Ресторан и еда|Взял шоколадку к кофе
0|site.ru/snacks-36|Газировка|Ресторан и еда|Купил спрайт и сухарики
0|site.ru/snacks-37|Пиво|Ресторан и еда|Закинул пару лагеров домой
0|site.ru/snacks-38|Сидр|Ресторан и еда|Купила сидр и орешки
0|site.ru/snacks-39|Мармелад|Ресторан и еда|Взял мармелад и сок
0|site.ru/snacks-40|Сладости|Ресторан и еда|Купил сладостей к чаю
0|site.ru/snacks-41|Чипсы|Ресторан и еда|Взял чипсы и пепси
0|site.ru/snacks-42|Вино|Ресторан и еда|Купила белое вино к ужину
0|site.ru/snacks-43|Орешки|Ресторан и еда|Взял арахис и газировку
0|site.ru/snacks-44|Пиво|Ресторан и еда|Купил пиво и кальмары
0|site.ru/snacks-45|Энергос|Ресторан и еда|Закинул энергос перед залом
0|site.ru/snacks-46|Кола|Ресторан и еда|Купил колу и печенье
0|site.ru/snacks-47|Шоколад|Ресторан и еда|Взяла шоколадку и сок
0|site.ru/snacks-48|Сухарики|Ресторан и еда|Купил сухарики к пиву
0|site.ru/snacks-49|Лимонад|Ресторан и еда|Взял лимонад и чипсы
0|site.ru/snacks-50|Пиво|Ресторан и еда|Купил баночку пива вечером
0|site.ru/family-1|Закупка|Ресторан и еда|Купила всё на неделю, молочка, мясо, овощи, рублей 90 вышло
0|site.ru/family-2|Детям|Ресторан и еда|Детям взяла йогурты, сок и печенье в школу
0|site.ru/family-3|Ужин|Ресторан и еда|На ужин взяла фарш, картошку и салат
0|site.ru/family-4|Завтрак|Ресторан и еда|Купила яйца, хлеб и масло на завтрак всем
0|site.ru/family-5|Продукты|Ресторан и еда|Взяла продукты на пару дней, вышло около 40 рублей
0|site.ru/family-6|Молочка|Ресторан и еда|Купила молоко, творог и йогурты детям
0|site.ru/family-7|Обед|Ресторан и еда|Сделала закупку на обеды, курица и гречка
0|site.ru/family-8|Суп|Ресторан и еда|Взяла мясо, картошку и морковь на суп
0|site.ru/family-9|Перекус|Ресторан и еда|Детям купила фрукты и соки в школу
0|site.ru/family-10|Закупка|Ресторан и еда|Закупилась в евроопте на семью, рублей 70 вышло
0|site.ru/family-11|Мясо|Ресторан и еда|Взяла курицу и фарш на несколько дней
0|site.ru/family-12|Овощи|Ресторан и еда|Купила овощи на салаты и супы
0|site.ru/family-13|Школа|Ресторан и еда|Детям взяла бутерброды и йогурты в школу
0|site.ru/family-14|Ужин|Ресторан и еда|На ужин взяла котлеты и макароны
0|site.ru/family-15|Закупка|Ресторан и еда|Потратилась на продукты для семьи, рублей 85
0|site.ru/family-16|Фрукты|Ресторан и еда|Купила яблоки, бананы и виноград детям
0|site.ru/family-17|Молочка|Ресторан и еда|Взяла кефир, молоко и сыр
0|site.ru/family-18|Завтрак|Ресторан и еда|Купила хлопья, молоко и булочки
0|site.ru/family-19|Ужин|Ресторан и еда|Взяла курицу и рис на ужин
0|site.ru/family-20|Продукты|Ресторан и еда|Купила продукты на выходные всей семьей
0|site.ru/family-21|Детям|Ресторан и еда|Детям взяла сладости и сок
0|site.ru/family-22|Суп|Ресторан и еда|Взяла овощи и мясо на суп
0|site.ru/family-23|Закупка|Ресторан и еда|Закупилась в алми на неделю, рублей 100
0|site.ru/family-24|Обед|Ресторан и еда|Купила гречку, котлеты и салат
0|site.ru/family-25|Перекус|Ресторан и еда|Взяла йогурты и печенье детям
0|site.ru/family-26|Мясо|Ресторан и еда|Купила свинину и курицу на семью
0|site.ru/family-27|Овощи|Ресторан и еда|Взяла картошку, лук и морковь
0|site.ru/family-28|Ужин|Ресторан и еда|На ужин купила пюре и котлеты
0|site.ru/family-29|Завтрак|Ресторан и еда|Купила яйца, хлеб и масло
0|site.ru/family-30|Закупка|Ресторан и еда|Потратилась на продукты, около 60 рублей
0|site.ru/family-31|Детям|Ресторан и еда|Детям взяла сок и фрукты в школу
0|site.ru/family-32|Молочка|Ресторан и еда|Купила молочку на всю семью
0|site.ru/family-33|Суп|Ресторан и еда|Взяла мясо и овощи на суп
0|site.ru/family-34|Обед|Ресторан и еда|Приготовила продукты на обеды
0|site.ru/family-35|Ужин|Ресторан и еда|Купила курицу и гарнир
0|site.ru/family-36|Закупка|Ресторан и еда|Закупилась на неделю, вышло 95 рублей
0|site.ru/family-37|Фрукты|Ресторан и еда|Купила фрукты детям и себе
0|site.ru/family-38|Перекус|Ресторан и еда|Взяла перекус в школу детям
0|site.ru/family-39|Продукты|Ресторан и еда|Купила продукты для дома
0|site.ru/family-40|Мясо|Ресторан и еда|Взяла фарш и курицу на ужин
0|site.ru/family-41|Овощи|Ресторан и еда|Купила овощи для салатов и супов
0|site.ru/family-42|Завтрак|Ресторан и еда|Взяла молоко, яйца и хлеб
0|site.ru/family-43|Ужин|Ресторан и еда|Купила макароны и мясо
0|site.ru/family-44|Детям|Ресторан и еда|Детям купила йогурты и печенье
0|site.ru/family-45|Закупка|Ресторан и еда|Потратилась в гиппо на продукты, рублей 80
0|site.ru/family-46|Обед|Ресторан и еда|Взяла котлеты и гречку
0|site.ru/family-47|Суп|Ресторан и еда|Купила овощи и мясо на суп
0|site.ru/family-48|Продукты|Ресторан и еда|Купила всё для дома на несколько дней
0|site.ru/family-49|Завтрак|Ресторан и еда|Взяла хлопья и молоко детям
0|site.ru/family-50|Закупка|Ресторан и еда|Купила продукты на неделю для всей семьи, рублей 100
0|site.ru/market-1|Рынок|Ресторан и еда|Купил на рынке огурцы, помидоры и зелень
0|site.ru/market-2|Фермер|Ресторан и еда|Взял у фермера молоко и яйца свежие
0|site.ru/market-3|Пекарня|Ресторан и еда|Купил в пекарне горячий хлеб и булочки
0|site.ru/market-4|Суши|Ресторан и еда|Заказали суши на вечер, сет на двоих
0|site.ru/market-5|Пицца|Ресторан и еда|Взяли пиццу в пиццерии на компанию
0|site.ru/market-6|Рынок|Ресторан и еда|Купил картошку и морковь у бабушек на рынке
0|site.ru/market-7|Фермер|Ресторан и еда|Взял домашний творог и сметану у фермера
0|site.ru/market-8|Кулинария|Ресторан и еда|Купил салаты и котлеты в кулинарии
0|site.ru/market-9|Пекарня|Ресторан и еда|Взял свежие круассаны и хлеб
0|site.ru/market-10|Суши|Ресторан и еда|Заказал роллы и мисо суп домой
0|site.ru/market-11|Пицца|Ресторан и еда|Взяли большую пиццу с доставкой
0|site.ru/market-12|Рынок|Ресторан и еда|Купил на рынке ягоды и зелень
0|site.ru/market-13|Фермер|Ресторан и еда|Взял мясо у фермеров на ужин
0|site.ru/market-14|Пекарня|Ресторан и еда|Купил булочки и пирожки в пекарне
0|site.ru/market-15|Кулинария|Ресторан и еда|Взял готовую еду в кулинарии на обед
0|site.ru/market-16|Суши|Ресторан и еда|Заказали суши сет на вечер с друзьями
0|site.ru/market-17|Пицца|Ресторан и еда|Купили пиццу и колу на фильм
0|site.ru/market-18|Рынок|Ресторан и еда|Взял на рынке помидоры и перец
0|site.ru/market-19|Фермер|Ресторан и еда|Купил яйца и молоко у фермера
0|site.ru/market-20|Пекарня|Ресторан и еда|Взял свежий багет и булки
0|site.ru/market-21|Кулинария|Ресторан и еда|Купил салат и курицу в кулинарии
0|site.ru/market-22|Суши|Ресторан и еда|Заказал суши домой на ужин
0|site.ru/market-23|Пицца|Ресторан и еда|Взяли пиццу на двоих вечером
0|site.ru/market-24|Рынок|Ресторан и еда|Купил зелень и редис на рынке
0|site.ru/market-25|Фермер|Ресторан и еда|Взял сыр и молочку у фермера
0|site.ru/market-26|Пекарня|Ресторан и еда|Купил свежий хлеб и слойки
0|site.ru/market-27|Кулинария|Ресторан и еда|Взял котлеты и гарнир в кулинарии
0|site.ru/market-28|Суши|Ресторан и еда|Заказали роллы и суши на компанию
0|site.ru/market-29|Пицца|Ресторан и еда|Купили пиццу и картошку фри
0|site.ru/market-30|Рынок|Ресторан и еда|Взял на рынке клубнику и овощи
0|site.ru/market-31|Фермер|Ресторан и еда|Купил мясо и яйца у фермеров
0|site.ru/market-32|Пекарня|Ресторан и еда|Взял булочки и пирожки к чаю
0|site.ru/market-33|Кулинария|Ресторан и еда|Купил готовый обед в кулинарии
0|site.ru/market-34|Суши|Ресторан и еда|Заказал суши и роллы домой
0|site.ru/market-35|Пицца|Ресторан и еда|Взяли пиццу и напитки на вечер
0|site.ru/market-36|Рынок|Ресторан и еда|Купил картошку и огурцы на рынке
0|site.ru/market-37|Фермер|Ресторан и еда|Взял творог и сметану у фермеров
0|site.ru/market-38|Пекарня|Ресторан и еда|Купил свежий хлеб и круассаны
0|site.ru/market-39|Кулинария|Ресторан и еда|Взял салат и горячее в кулинарии
0|site.ru/market-40|Суши|Ресторан и еда|Заказали суши сет на ужин
0|site.ru/market-41|Пицца|Ресторан и еда|Купил пиццу на вечер с друзьями
0|site.ru/market-42|Рынок|Ресторан и еда|Взял на рынке зелень и фрукты
0|site.ru/market-43|Фермер|Ресторан и еда|Купил домашний сыр у фермера
0|site.ru/market-44|Пекарня|Ресторан и еда|Взял горячие булочки и хлеб
0|site.ru/market-45|Кулинария|Ресторан и еда|Купил котлеты и пюре в кулинарии
0|site.ru/market-46|Суши|Ресторан и еда|Заказали роллы и суши на вечер
0|site.ru/market-47|Пицца|Ресторан и еда|Взяли пиццу и напитки домой
0|site.ru/market-48|Рынок|Ресторан и еда|Купил овощи и ягоды на рынке
0|site.ru/market-49|Фермер|Ресторан и еда|Взял молоко и яйца у фермеров
0|site.ru/market-50|Пекарня|Ресторан и еда|Купил свежий хлеб и выпечку утром
0|site.ru/transport-1|Метро|Транспорт|Доехал на метро до центра по делам
0|site.ru/transport-2|Автобус|Транспорт|Поехал на автобусе на работу утром
0|site.ru/transport-3|Такси|Транспорт|Вызвал яндекс такси домой вечером
0|site.ru/transport-4|Самокат|Транспорт|Прокатился на самокате до магазина, рублей 3
0|site.ru/transport-5|Трамвай|Транспорт|Доехал на трамвае в центр города
0|site.ru/transport-6|Маршрутка|Транспорт|Сел в маршрутку до района, быстро доехал
0|site.ru/transport-7|Метро|Транспорт|Спустился в метро, доехал без пробок
0|site.ru/transport-8|Такси|Транспорт|Заказал убер до дома после работы
0|site.ru/transport-9|Велосипед|Транспорт|Проехался на велосипеде до парка
0|site.ru/transport-10|Автобус|Транспорт|Автобусом доехал до универа
0|site.ru/transport-11|Самокат|Транспорт|Взял самокат до метро, вышло дешево
0|site.ru/transport-12|Троллейбус|Транспорт|Поехал на троллейбусе в центр
0|site.ru/transport-13|Метро|Транспорт|Проехал пару станций на метро
0|site.ru/transport-14|Такси|Транспорт|Вызвал такси до вокзала срочно
0|site.ru/transport-15|Маршрутка|Транспорт|Сел в маршрутку и доехал домой
0|site.ru/transport-16|Трамвай|Транспорт|Доехал на трамвае до работы
0|site.ru/transport-17|Автобус|Транспорт|Автобусом поехал в центр города
0|site.ru/transport-18|Велосипед|Транспорт|Взял велик и поехал по делам
0|site.ru/transport-19|Самокат|Транспорт|Прокатился на самокате вечером
0|site.ru/transport-20|Такси|Транспорт|Яндекс такси домой после встречи
0|site.ru/transport-21|Метро|Транспорт|Доехал на метро быстро без пересадок
0|site.ru/transport-22|Автобус|Транспорт|Автобусом до торгового центра
0|site.ru/transport-23|Троллейбус|Транспорт|Троллейбусом доехал до работы
0|site.ru/transport-24|Маршрутка|Транспорт|Маршруткой до центра города поехал
0|site.ru/transport-25|Такси|Транспорт|Убер вызвал до дома ночью
0|site.ru/transport-26|Самокат|Транспорт|Самокат до метро, быстро и удобно
0|site.ru/transport-27|Велосипед|Транспорт|Велосипедом до парка прокатился
0|site.ru/transport-28|Метро|Транспорт|Метро до работы утром без пробок
0|site.ru/transport-29|Автобус|Транспорт|На автобусе поехал в центр
0|site.ru/transport-30|Такси|Транспорт|Вызвал такси до аэропорта
0|site.ru/transport-31|Трамвай|Транспорт|Трамваем доехал до универа
0|site.ru/transport-32|Самокат|Транспорт|Прокат самоката до дома
0|site.ru/transport-33|Маршрутка|Транспорт|Маршрутка до работы утром
0|site.ru/transport-34|Метро|Транспорт|Проехал на метро пару остановок
0|site.ru/transport-35|Такси|Транспорт|Заказал такси через приложение
0|site.ru/transport-36|Автобус|Транспорт|Автобусом до рынка доехал
0|site.ru/transport-37|Велосипед|Транспорт|Взял велосипед на прокат
0|site.ru/transport-38|Троллейбус|Транспорт|Троллейбус до центра города
0|site.ru/transport-39|Самокат|Транспорт|Самокат до магазина за пару рублей
0|site.ru/transport-40|Метро|Транспорт|Метро до вокзала быстро
0|site.ru/transport-41|Такси|Транспорт|Яндекс такси домой вечером
0|site.ru/transport-42|Маршрутка|Транспорт|Маршрутка до дома после работы
0|site.ru/transport-43|Автобус|Транспорт|Автобус до центра города утром
0|site.ru/transport-44|Трамвай|Транспорт|Трамваем доехал до остановки
0|site.ru/transport-45|Велосипед|Транспорт|Велосипед до работы поехал
0|site.ru/transport-46|Самокат|Транспорт|Самокат до метро утром
0|site.ru/transport-47|Метро|Транспорт|Метро до центра без пересадок
0|site.ru/transport-48|Такси|Транспорт|Убер до дома быстро доехал
0|site.ru/transport-49|Автобус|Транспорт|Автобусом вернулся домой вечером
0|site.ru/transport-50|Троллейбус|Транспорт|Троллейбус до работы с утра
0|site.ru/auto-1|Бензин|Транспорт|Заправил полный бак бензина, рублей 60 вышло
0|site.ru/auto-2|Мойка|Транспорт|Заехал на мойку, помыл машину после трассы
0|site.ru/auto-3|Парковка|Транспорт|Оплатил парковку в центре города
0|site.ru/auto-4|Масло|Транспорт|Купил моторное масло и долил в двигатель
0|site.ru/auto-5|Омывайка|Транспорт|Взял омывайку для стекол, закончилась
0|site.ru/auto-6|Шиномонтаж|Транспорт|Переобулся на шиномонтаже, сезон начался
0|site.ru/auto-7|Страховка|Транспорт|Продлил страховку на автомобиль на год
0|site.ru/auto-8|ТО|Транспорт|Прошел техосмотр, пришлось заплатить
0|site.ru/auto-9|Аккум|Транспорт|Купил новый аккумулятор, старый сел
0|site.ru/auto-10|Запчасти|Транспорт|Взял запчасти для ремонта подвески
0|site.ru/auto-11|Бензин|Транспорт|Залил бензин по пути домой
0|site.ru/auto-12|Мойка|Транспорт|Помыл машину на автоматической мойке
0|site.ru/auto-13|Парковка|Транспорт|Заплатил за парковку у торгового центра
0|site.ru/auto-14|Масло|Транспорт|Заменил масло в сервисе
0|site.ru/auto-15|Омывайка|Транспорт|Купил жидкость для стеклоомывателя
0|site.ru/auto-16|Шины|Транспорт|Купил комплект новых шин
0|site.ru/auto-17|Диски|Транспорт|Взял новые диски на машину
0|site.ru/auto-18|ТО|Транспорт|Сделал техобслуживание авто
0|site.ru/auto-19|Страховка|Транспорт|Оформил КАСКО на машину
0|site.ru/auto-20|Бензин|Транспорт|Заправился на АЗС по дороге
0|site.ru/auto-21|Мойка|Транспорт|Заехал быстро на мойку
0|site.ru/auto-22|Парковка|Транспорт|Оплатил парковку на час
0|site.ru/auto-23|Запчасти|Транспорт|Купил тормозные колодки
0|site.ru/auto-24|Масло|Транспорт|Долил масло в двигатель
0|site.ru/auto-25|Омывайка|Транспорт|Взял незамерзайку для зимы
0|site.ru/auto-26|Шиномонтаж|Транспорт|Переобул машину на лето
0|site.ru/auto-27|Аккум|Транспорт|Купил аккумулятор для авто
0|site.ru/auto-28|ТО|Транспорт|Прошел плановое ТО машины
0|site.ru/auto-29|Бензин|Транспорт|Залил полный бак перед поездкой
0|site.ru/auto-30|Мойка|Транспорт|Помыл авто после дождя
0|site.ru/auto-31|Парковка|Транспорт|Заплатил за стоянку
0|site.ru/auto-32|Масло|Транспорт|Купил масло для замены
0|site.ru/auto-33|Запчасти|Транспорт|Взял ремень ГРМ
0|site.ru/auto-34|Омывайка|Транспорт|Купил омывающую жидкость
0|site.ru/auto-35|Шины|Транспорт|Купил зимние шины
0|site.ru/auto-36|Диски|Транспорт|Взял комплект дисков
0|site.ru/auto-37|Страховка|Транспорт|Продлил автостраховку
0|site.ru/auto-38|ТО|Транспорт|Сделал диагностику авто
0|site.ru/auto-39|Бензин|Транспорт|Заправился до полного бака
0|site.ru/auto-40|Мойка|Транспорт|Заехал на бесконтактную мойку
0|site.ru/auto-41|Парковка|Транспорт|Оплатил парковку в городе
0|site.ru/auto-42|Масло|Транспорт|Заменил моторное масло
0|site.ru/auto-43|Запчасти|Транспорт|Купил свечи зажигания
0|site.ru/auto-44|Омывайка|Транспорт|Взял жидкость для стекла
0|site.ru/auto-45|Шиномонтаж|Транспорт|Сезонная замена резины
0|site.ru/auto-46|Аккум|Транспорт|Поставил новый аккумулятор
0|site.ru/auto-47|ТО|Транспорт|Прошел техосмотр машины
0|site.ru/auto-48|Бензин|Транспорт|Залил бензин перед трассой
0|site.ru/auto-49|Мойка|Транспорт|Помыл машину перед встречей
0|site.ru/auto-50|Парковка|Транспорт|Заплатил за парковку у офиса
0|site.ru/travel-1|Поезд|Транспорт|Взял билет на поезд до Гродно
0|site.ru/travel-2|Автобус|Транспорт|Уехал автобусом в другой город
0|site.ru/travel-3|Самолёт|Транспорт|Слетал в Варшаву, билеты и дорога
