num|url|title|category|data
0|https://fitaudit.ru/food/abc|Хлеб белый пшеничный|Ресторан и еда|Хлеб белый пшеничный — это хлеб, сделанный из пшеничной муки высшего сорта, который отличается светлым цветом и мягкой текстурой. Он обладает нейтральным вкусом и часто используется для приготовления сэндвичей, тостов и подачи к различным блюдам. Белый пшеничный хлеб обычно легче усваивается, но содержит меньше клетчатки по сравнению с хлебом из цельнозерновой муки.
0|https://fitaudit.ru/food/abc|Хлебцы мультизерновые|Ресторан и еда|Хлебцы мультизерновые — это продукты, изготовленные из смеси различных злаков и семян. Обычно они содержат такие ингредиенты, как пшеница, рожь, овес, кукуруза, лён, кунжут и другие. Хлебцы имеют хрустящую текстуру и могут быть использованы как замена хлебу, а также в качестве перекуса. Они богаты клетчаткой, витаминами и минералами, что делает их полезным дополнением к рациону.
0|https://fitaudit.ru/food/abc|Хот-дог|Ресторан и еда|Хот-дог — это традиционное быстрое блюдо, обычно состоящее из сосиски, помещенной в разрезанную булочку. Его часто дополняют различными подливками и начинками, такими как горчица, кетчуп, майонез, лук, капуста и сыр. Хот-доги популярны на уличных ярмарках, спортивных мероприятиях и пикниках. Существует множество вариантов этого блюда, включая вегетарианские и экологически чистые варианты.
0|https://fitaudit.ru/food/abc|Хрен|Ресторан и еда|Хрен — это многолетнее растение, принадлежащее к семейству капустных. У него толстый корень с острым, жгучим вкусом, который используют в кулинарии, как пряность и приправу. Хрен часто добавляют в различные блюда, соусы и маринады, а также используют для приготовления хреновины. Кроме того, хрен обладает лечебными свойствами и применяется в народной медицине.
0|https://fitaudit.ru/food/abc|Хурма|Ресторан и еда|Хурма — это сладкий плод, принадлежащий к семейству эбеновых. Научное название растения — Diospyros. Хурма бывает различных сортов, наиболее известные из которых — японская (ширатама) и восточная. Плоды имеют ярко-оранжевый или желтый цвет и сладкий вкус. Хурма богата витаминами (особенно витамином С), минералами и антиоксидантами, и её употребление полезно для здоровья. Плоды могут быть свежими, сушеными или использоваться в кулинарии для различных блюд.
0|https://fitaudit.ru/food/abc|Цветная капуста|Ресторан и еда|Цветная капуста — это разновидность капусты, относящаяся к семейству крестоцветных. Она отличается белыми соцветиями, которые образуют плотные головки, и обычно употребляется в пищу как овощ. Цветная капуста богата витаминами (особенно C, K и групой B), минералами и клетчаткой, что делает ее полезной для питания. Она может быть приготовлена различными способами: отварной, запеченной, жареной или используемой в салатах. Существует также брокколи, которая является близким родственником цветной капусты.
0|https://fitaudit.ru/food/abc|Цедра апельсина (кожура)|Ресторан и еда|Цедра апельсина — это внешняя кожура апельсина, которая содержит эфирные масла и ароматические соединения. Она имеет яркий, насыщенный аромат и используется в кулинарии для добавления вкуса в десерты, напитки и соусы. Цедра богата витаминами и антиоксидантами, а также может использоваться в народной медицине и косметологии.
0|https://fitaudit.ru/food/abc|Цикорий|Ресторан и еда|Цикорий — это растение, принадлежащее к семейству астровых. Обычно его используют в качестве пищевой добавки, а также для приготовления напитков, напоминающих кофе. Корни цикория могут быть обжарены и измельчены, что придаёт им характерный вкус и аромат. Цикорий также ценится за свои полезные свойства: он может способствовать улучшению пищеварения, поддерживать здоровье печени и обладать антиоксидантными свойствами. В народной медицине зачастую используются и другие части растения.
0|https://fitaudit.ru/food/abc|Чабер|Ресторан и еда|"Чабер — это растение, относящееся к семейству яснотковых. Его также называют ""чабрец"" или ""тимьян"". Чабер известен своими ароматными листьями и используется в кулинарии как приправа, а также в народной медицине благодаря своим потенциальным полезным свойствам, таким как антибактериальное и противовоспалительное действие. Он применяется в приготовлении мясных и овощных блюд, а также в чаях и настойках. Растение имеет приятный запах и часто используется для улучшения вкуса блюд."
0|https://fitaudit.ru/food/abc|Чавыча|Ресторан и еда|Чавыча — это вид рыбы из семейства лососевых, также известный как кижуч или красная рыба. Она обитает в северных водах Тихого океана, в реках и морях от Калифорнии до Чукотки. Чавыча ценится за свое мясо, которое имеет ярко-красный цвет, и высокое содержание Omega-3 жирных кислот. Рыба широко используется в кулинарии, а также в производстве консервов и копченостей. Чавыча также является объектом спортивной рыбалки и коммерческого лова.
0|https://fitaudit.ru/food/abc|Чай Nestea|Ресторан и еда|Чай Nestea — это бренд готовых к употреблению и растворимых чая, принадлежащий компании Nestlé. Он предлагает разнообразные варианты чайных напитков, включая черный, зеленый и фруктовые вкусы, как с добавлением сахара, так и без. Nestea известен своим освежающим вкусом и удобством, так как доступен в бутылках, пакетиках и картонных упаковках. Бренд ориентирован на любителей чая, ищущих быстрые и вкусные решения для утоления жажды.
0|https://fitaudit.ru/food/abc|Чайот|Ресторан и еда|Чайот (Sechium edule) — это съедобный плод растения семейства тыквенных, родом из Центральной и Южной Америки. Чайот также известен как мексиканская тыква или овощная груша. Плоды имеют зеленую кожицу и рыхлую мякоть, которую употребляют в пищу как в сыром, так и в варёном виде. Чайот богат витаминами и минералами, а также обладает низкой калорийностью, что делает его популярным овощем в разных кухнях мира. В листьях, стеблях и корнях растения также содержатся питательные вещества, и они также могут использоваться в кулинарии.
0|https://fitaudit.ru/food/abc|Черимойя|Ресторан и еда|Черимойя — это тропический фрукт, который относится к семейству анноновых. Он имеет зеленоватую кожуру с морщинистой поверхностью и сладкую, сочную мякоть белого цвета, иногда с черными семенами. Вкус черимойи напоминает сочетание ананаса, банана и крема. Этот фрукт богат витаминами, минералами и антиоксидантами. Черимойя чаще всего употребляется в сыром виде, а также используется в десертах и напитках.
0|https://fitaudit.ru/food/abc|Чернослив|Ресторан и еда|"Чернослив — это сушеные плоды сливы, обычно сорта ""венгерка"". Он имеет темную окраску, плотную текстуру и сладкий вкус. Чернослив богат витаминами, минералами и пищевыми волокнами, а также полезен для пищеварения, поддерживает здоровье сердечно-сосудистой системы и обладает антиоксидантными свойствами. Его часто используют в кулинарии, добавляя в десерты, салаты и блюда из мяса."
0|https://fitaudit.ru/food/abc|Чёрный орех|Ресторан и еда|Чёрный орех (Juglans nigra) — это дерево семейства ореховых, родом из Северной Америки. Оно известно своим темным, прочным древесиной, которая широко используется в мебельном производстве и декоративных целях. Плод чёрного ореха является съедобным, но отличается горьковатым вкусом, и его редко употребляют в чистом виде. Чёрный орех также имеет лечебные свойства и используется в народной медицине.
0|https://fitaudit.ru/food/abc|Чеснок|Ресторан и еда|Чеснок (Allium sativum) — это однолетнее травянистое растение семейства луковых. Он известен своим характерным острым вкусом и запахом, а также широким использованием в кулинарии как приправа. Чеснок обладает множеством полезных свойств, включая антимикробные и антиоксидантные качества, и считается средством для укрепления иммунной системы. В народной медицине чеснок часто используется для профилактики и лечения различных заболеваний.
0|https://fitaudit.ru/food/abc|Чечевица|Ресторан и еда|Чечевица — это бобовое растение, относящееся к семейству бобовых. Она широко используется в кулинарии благодаря своему высокому содержанию белка, витаминов и минералов. Чечевица бывает разных сортов, включая зеленую, коричневую, красную и черную, и обычно используется в soups, салатах, гарнирах и вегетарианских блюдах. Кроме того, она легко готовится и быстро усваивается организмом.
0|https://fitaudit.ru/food/abc|Чизбургер (Макдоналдс)|Ресторан и еда|Чизбургер — это популярный гамбургер из меню McDonald's, состоящий из мясной котлеты, сыра, маринованных огурцов, лука, кетчупа и горчицы, помещённых между двумя булочками. Он отличается от обычного гамбургера наличием плавленого сыра, что придаёт ему особый вкус. Чизбургер является одним из самых известных и любимых блюд сети ресторанов быстрого питания.
0|https://fitaudit.ru/food/abc|Чизкейк|Ресторан и еда|Чизкейк — это десерт, основой которого является сыр (обычно творожный или сливочный), смешанный с сахаром и яйцами. Чизкейк может быть как выпеченным, так и не подвергнутым термической обработке. Он часто подается на крекерном или песочном корже и может быть украшен фруктами, шоколадом или ягодами. Существует множество вариантов чизкейка, включая классическийNew York cheesecake, а также более креативные сочетания вкусов.
0|https://fitaudit.ru/food/abc|Чипсы картофельные|Ресторан и еда|Чипсы картофельные — это тонко нарезанные и обжаренные до хрустящей корочки куски картофеля. Они обычно подаются в виде закуски и могут иметь различные вкусы благодаря приправам, используется соль, а также другие добавки, такие как сыр, лук, паприка и многие другие. Чипсы часто перекусывают в неформальной обстановке и популярны во всем мире.
0|https://fitaudit.ru/food/abc|Шалфей|Ресторан и еда|Шалфей — это род многолетних травянистых растений из семейства яснотковых. Наиболее известный вид — шалфей лекарственный (Salvia officinalis), который широко используется в кулинарии и традиционной медицине. Шалфей обладает характерным ароматом и полезными свойствами, такими как антиоксидантное и противовоспалительное действие. Его листья могут применяться в качестве специи, а также для приготовления чая и настоев. Турmeric и шалфей часто используются в народной медицине для поддержания здоровья.
0|https://fitaudit.ru/food/abc|Шампиньоны|Ресторан и еда|Шампиньоны — это вид съедобных грибов, относящийся к семейству шампиньоновых. Они имеют круглую шляпку, обычно белого или коричневого цвета, и мясистую ножку. Шампиньоны широко распространены и часто используются в кулинарии благодаря своему приятному вкусу и универсальности. Их можно употреблять в сыром виде, добавлять в салаты, готовить, запекать и жарить. Кроме того, шампиньоны содержат витамины, минералы и антиоксиданты, что делает их полезными для здоровья.
0|https://fitaudit.ru/food/abc|Шафран|Ресторан и еда|Шафран — это пряность, получаемая из высушенных рыльцев цветка шафрана (Crocus sativus). Он считается одной из самых дорогих специй в мире из-за трудоемкости процесса сбора, так как рыльца необходимо вручную собирать во время цветения. Шафран обладает ярким ароматом и уникальным вкусом, а также придаёт блюдам насыщенный золотистый цвет. Используется в кулинарии, медицине и косметологии.
0|https://fitaudit.ru/food/abc|Шейка свиная (шея)|Ресторан и еда|Шейка свиная (шея) — это часть свиной туши, которая находится между головой и плечом. Она состоит из мясистого, но нежного мяса с прослойками жира, что придает ей сочность и богатый вкус. Шейка часто используется для приготовления шашлыков, запеканок, рагу и других блюд, а также может быть фарширована. Благодаря своей универсальности и хорошим кулинарным качествам, она популярна в кулинарии.
0|https://fitaudit.ru/food/abc|Шелковица|Ресторан и еда|Шелковица — это плодовое дерево или кустарник, принадлежащее к роду тутовых (Moraceae). Шелковица делится на два основных вида: черную и белую. Плоды шелковицы съедобны, сладкие и сочные, и часто используются в кулинарии для приготовления варенья, компотов, десертов. Кроме того, шелковица ценится за древесину и листья, которые используются для кормления шелкопрядов. Деревья хорошо растут в теплых климатах и часто встречаются в садах и на приусадебных участках.
0|https://fitaudit.ru/food/abc|Шея индейки|Ресторан и еда|Шея индейки — это часть туши индейки, представляющая собой мясистую и мясистую область, расположенную на шее птицы. Обычно она содержит немного соединительной ткани и жира, что делает мясо нежным и вкусным. Шея индейки часто используется для приготовления бульонов, супов, а также может запекаться или тушиться. В кулинарии она ценится за свой насыщенный вкус и возможность добавления в различные блюда.
0|https://fitaudit.ru/food/abc|Шнитт-лук|Ресторан и еда|Шнитт-лук (или шнитт-лук, лат. Allium schoenoprasum) — это многолетнее травянистое растение из семейства луковых. Оно широко используется в кулинарии как пряность либо гарнир благодаря своему нежному луковому аромату и вкусу. Листья шнитт-лука тонкие и трубчатые, их обычно добавляют в салаты, соусы и другие блюда. Растение также ценится за свои полезные свойства, так как содержит витамины и антиоксиданты. Шнитт-лук легко вырастить на даче или в горшке, и он подходит для использования в свежем виде.
0|https://fitaudit.ru/food/abc|Шоколад Dove (молочный)|Ресторан и еда|Шоколад Dove — это популярный бренд молочного шоколада, известный своим нежным вкусом и гладкой текстурой. Он производится компанией Mars, Incorporated и отличается высоким содержанием какао-масла, что придает ему мягкость и кремовость. Шоколад Dove часто представлен в различных вариантах, включая плитки и конфеты с разными начинками. Бренд акцентирует внимание на качестве ингредиентов и приятных эмоциях, связанных с его продукцией.
0|https://fitaudit.ru/food/abc|Шоколадный батончик KitKat|Ресторан и еда|Шоколадный батончик KitKat — популярное кондитерское изделие, производимое компанией Nestlé. Он состоит из нескольких хрустящих вафель, покрытых слоем молочного шоколада. Известен своим слоистым дизайном и характерным хрустом. Впервые был представлен в Великобритании в 1935 году и с тех пор стал одним из самых узнаваемых и продаваемых сладостей в мире. KitKat также предлагает различные вариации вкусов и ограниченные выпуски, что делает его привлекательным для широкой аудитории.
0|https://fitaudit.ru/food/abc|Шпинат|Ресторан и еда|Шпинат — зеленое листовое овощное растение, принадлежащее к семейству амарантовых. Он богат витаминами (особенно A, C и K), минералами (такими как железо и калий) и антиоксидантами. Шпинат употребляют в свежем виде в салатах, а также в приготовленных блюдах, таких как супы, запеканки и омлеты. Это низкокалорийный продукт с высоким содержанием клетчатки, что делает его популярным компонентом здорового питания.
