num|url|title|category|data
0|https://www.spr.by/branches/sosedi/reviews/|Товаровед не справляется с работой и хамит покупателям|Ресторан и еда|Купила острые сухарики к пиву. Когда развернула оказалось что они не острые, без специй. Это просто высохший серый хлеб. Абсолютно безвкусный. Ощущение будто делали из просрочки.
0|https://www.spr.by/branches/sosedi/reviews/|Товаровед не справляется с работой и хамит покупателям|Ресторан и еда|Купила утку маринованную, 06. 01. 23. Испорченная. Спасибо.
0|site.ru/utilities-1|Коммунальные платежи|Жилье|Заплатил за коммунальные услуги за прошлый месяц. В сумму вошли вода, электричество и отопление. Оплату сделал через личный кабинет.
0|site.ru/mortgage-1|Ипотечный платеж|Жилье|Внес ежемесячный платеж по ипотеке. Банк автоматически списал средства с карты. Это обязательный регулярный расход.
0|site.ru/rent-room|Съем комнаты|Жилье|Оплатил аренду комнаты в квартире. Перевел деньги арендодателю на карту. Цена ниже, чем за отдельную квартиру.
0|site.ru/water-bill|Оплата воды|Жилье|Заплатил за холодную и горячую воду. Счет сформирован по показаниям счетчиков. Оплату провел онлайн.
0|site.ru/heating|Отопление|Жилье|Оплатил отопление за зимний период. Сумма получилась довольно высокой. Это сезонный расход.
0|site.ru/repair-fund|Фонд капремонта|Жилье|Оплатил взнос в фонд капитального ремонта. Этот платеж начисляется ежемесячно. Деньги идут на ремонт дома.
0|site.ru/rent-house|Аренда дома|Жилье|Снял дом и оплатил аренду за месяц. Сделал перевод владельцу. Стоимость выше, чем у квартиры.
0|site.ru/gas|Оплата газа|Жилье|Заплатил за газ по счетчику. Используется для приготовления пищи и отопления. Оплату сделал через приложение.
0|site.ru/internet-home|Домашний интернет|Жилье|Оплатил домашний интернет на месяц вперед. Без этого сложно работать из дома. Платеж регулярный.
0|site.ru/parking|Парковка у дома|Жилье|Заплатил за парковочное место возле дома. Это ежемесячная аренда. Удобно, но добавляет расходов.
0|site.ru/cleaning|Уборка квартиры|Жилье|Заказал уборку квартиры и оплатил услугу. Клинеры пришли и все привели в порядок. Это нечастый, но полезный расход.
0|site.ru/security|Охрана дома|Жилье|Оплатил услуги охраны жилого комплекса. Включает видеонаблюдение и контроль доступа. Чувствую себя безопаснее.
0|site.ru/deposit|Залог за квартиру|Жилье|Внес залог при съеме квартиры. Деньги удерживаются до окончания аренды. Это стандартная практика.
0|site.ru/agency|Услуги риелтора|Жилье|Оплатил комиссию агентству недвижимости. Они помогли найти квартиру. Разовый, но ощутимый расход.
0|site.ru/furniture-rent|Аренда мебели|Жилье|Взял мебель в аренду и оплатил первый месяц. Это временное решение. Удобно при переезде.
0|site.ru/trash|Вывоз мусора|Жилье|Оплатил услугу вывоза мусора. Включена в коммунальные платежи. Сумма небольшая.
0|site.ru/intercom|Домофон|Жилье|Заплатил за обслуживание домофона. Это ежемесячный платеж. Обеспечивает доступ в подъезд.
0|site.ru/lighting|Освещение подъезда|Жилье|Оплатил освещение общих зон в доме. Входит в коммунальные услуги. Начисляется автоматически.
0|site.ru/elevator|Лифт|Жилье|Заплатил за обслуживание лифта. Это часть платежей за содержание дома. Без этого не обойтись.
0|site.ru/yard|Благоустройство|Жилье|Оплатил благоустройство двора. Включает уборку и озеленение. Делает территорию приятнее.
0|site.ru/rent-studio|Аренда студии|Жилье|Снял студию и оплатил проживание. Перевел деньги владельцу. Жилье компактное, но удобное.
0|site.ru/hostel|Хостел|Жилье|Оплатил проживание в хостеле. Это бюджетный вариант жилья. Подходит для коротких поездок.
0|site.ru/hotel-long|Длительное проживание|Жилье|Оплатил проживание в отеле на длительный срок. Это временная мера. Стоимость выше аренды.
0|site.ru/mortgage-insurance|Страховка ипотеки|Жилье|Оплатил страховку по ипотеке. Это обязательное условие банка. Платеж ежегодный.
0|site.ru/property-tax|Налог на имущество|Жилье|Заплатил налог на квартиру. Сумма зависит от стоимости недвижимости. Платеж ежегодный.
0|site.ru/rent-garage|Аренда гаража|Жилье|Снял гараж и оплатил аренду. Использую для хранения вещей. Удобное дополнение к жилью.
0|site.ru/maintenance|Обслуживание дома|Жилье|Оплатил услуги управляющей компании. Включает ремонт и обслуживание. Это регулярный платеж.
0|site.ru/window-clean|Мытье окон|Жилье|Заказал мытье окон в квартире. Оплатил услугу клининга. Делается несколько раз в год.
0|site.ru/pest-control|Обработка от вредителей|Жилье|Оплатил обработку квартиры от насекомых. Специалисты провели дезинфекцию. Это разовый расход.
0|site.ru/wifi-install|Подключение интернета|Жилье|Заплатил за подключение интернета. Мастер настроил оборудование. Теперь есть стабильный доступ.
0|site.ru/key-service|Изготовление ключей|Жилье|Сделал дубликаты ключей от квартиры. Оплатил услугу в мастерской. Полезно на случай потери.
0|site.ru/utility-penalty|Пени за коммуналку|Жилье|Заплатил пени за просрочку коммунальных платежей. Сумма небольшая, но неприятная. Теперь стараюсь платить вовремя.
0|site.ru/clean-entrance|Уборка подъезда|Жилье|Оплатил уборку подъезда. Услуга включена в содержание дома. Поддерживает чистоту.
0|site.ru/snow-removal|Уборка снега|Жилье|Оплатил уборку снега во дворе. Это сезонная услуга. Делает передвижение безопаснее.
0|site.ru/gas-45|Газ|Жилье|Оплатил газ, там копейки, но всё равно надо. По счетчику насчитали. Закрыл через приложение.
0|site.ru/hoa-48|ТСЖ|Жилье|Заплатил за ТСЖ, там всякие услуги по дому. Типа уборка, обслуживание и всё такое. Обычный ежемесячный расход.
0|site.ru/clean-52|Уборка|Жилье|Заказал уборку квартиры, вообще лень было самому. Заплатил ребятам, они всё сделали. Иногда можно себе позволить.
0|site.ru/security-53|Охрана|Жилье|Оплатил охрану в жилом комплексе. Там камеры, пропуска и всё такое. Вроде спокойнее стало.
0|site.ru/deposit-55|Залог|Жилье|Отдал залог за квартиру при заселении. Деньги немаленькие, конечно. Надеюсь потом вернут без проблем.
0|site.ru/agency-56|Риелтор|Жилье|Заплатил агенту за помощь с квартирой. Без него бы долго искал. Но комиссия прям ощутимая.
0|site.ru/intercom-59|Домофон|Жилье|Заплатил за домофон, а то могли отключить. Платеж копеечный, но обязательный. Теперь всё работает.
0|site.ru/studio-62|Студия|Жилье|Оплатил аренду студии, живу сейчас тут. Маленькая, но норм. Деньги перевел как обычно.
0|site.ru/hostel-63|Хостел|Жилье|Заплатил за хостел на пару дней. Бюджетно получилось. Для временного проживания норм.
0|site.ru/airbnb-65|Аренда посуточно|Жилье|Снял квартиру на пару дней через сервис. Сразу оплатил онлайн. Удобно, быстро заселился.
0|site.ru/mortgage-ins-66|Страховка ипотеки|Жилье|Заплатил страховку по ипотеке, обязательная штука. Без этого банк не разрешает. Платеж раз в год.
0|site.ru/tax-67|Налог|Жилье|Оплатил налог на квартиру. Честно, не люблю такие платежи. Но деваться некуда.
0|site.ru/garage-68|Гараж|Жилье|Снял гараж и сразу оплатил месяц. Удобно хранить вещи. Да и машина в безопасности.
0|site.ru/maint-69|Обслуживание|Жилье|Заплатил управляющей компании за обслуживание. Там всякие работы по дому. Регулярный расход.
0|site.ru/windows-70|Окна|Жилье|Заказал мытье окон, оплатил услугу. Самому было лень этим заниматься. Теперь всё чисто.
0|site.ru/pest-71|Дезинфекция|Жилье|Вызвал службу от насекомых, оплатил обработку. Были проблемы, пришлось решать. Надеюсь поможет.
0|site.ru/internet-install-72|Подключение|Жилье|Заплатил за подключение интернета. Мастер пришел, всё настроил. Теперь норм работает.
0|site.ru/keys-73|Ключи|Жилье|Сделал дубликат ключей, оплатил на месте. На всякий случай. Лучше иметь запасной.
0|site.ru/clean-entrance-76|Подъезд|Жилье|Оплатил уборку подъезда через платежку. Входит в общие расходы. Вроде чисто стало.
0|site.ru/slang-95|Залог|Жилье|Отдал залог за хату, норм сумма ушла. Надеюсь потом без приколов вернут. А то всякое бывает.
0|site.ru/slang-105|Посуточно|Жилье|Снял хату на сутки, сразу оплатил. Быстро заселился, без заморочек. Удобная тема.
0|site.ru/slang-111|Дезинфекция|Жилье|Заплатил за обработку от всякой живности. Были проблемы, пришлось вызывать. Надеюсь исчезнут.
0|site.ru/slang-113|Ключи|Жилье|Сделал запасные ключи, отдал немного денег. На всякий случай пусть будут. Мало ли потеряю.
0|site.ru/house-151|Аренда квартиры|Жилье|Оплатил аренду квартиры за текущий месяц. Перевел деньги владельцу через банковское приложение. Это регулярный ежемесячный расход.
0|site.ru/house-152|Коммунальные услуги|Жилье|Заплатил за коммунальные услуги. В сумму вошли вода, электричество и отопление. Оплату произвел онлайн.
0|site.ru/house-153|Ипотека|Жилье|Внес платеж по ипотеке. Банк списал средства автоматически. Это обязательный ежемесячный платеж.
0|site.ru/house-154|Интернет|Жилье|Оплатил домашний интернет. Подключение необходимо для работы и повседневных задач. Платеж внес заранее.
0|site.ru/house-155|Вода|Жилье|Оплатил счет за воду по показаниям счетчиков. Сумма оказалась стандартной. Платеж выполнен через приложение банка.
0|site.ru/house-156|Электричество|Жилье|Заплатил за электроэнергию. В этом месяце расход был немного выше. Оплату произвел сразу после получения счета.
0|site.ru/house-157|Газ|Жилье|Оплатил услуги газоснабжения. Начисление произведено по счетчику. Платеж выполнен онлайн.
0|site.ru/house-158|Комната|Жилье|Внес оплату за аренду комнаты. Деньги передал арендодателю. Стоимость ниже, чем у квартиры.
0|site.ru/house-159|Капремонт|Жилье|Заплатил взнос на капитальный ремонт. Этот платеж начисляется ежемесячно. Средства направляются на обслуживание дома.
0|site.ru/house-160|ТСЖ|Жилье|Оплатил услуги товарищества собственников жилья. Включает уборку и содержание территории. Это регулярный расход.
0|site.ru/house-161|Парковка|Жилье|Заплатил за аренду парковочного места. Место закреплено за квартирой. Платеж производится ежемесячно.
0|site.ru/house-162|Охрана|Жилье|Оплатил услуги охраны жилого комплекса. Включает видеонаблюдение и контроль доступа. Повышает уровень безопасности.
0|site.ru/house-163|Уборка|Жилье|Заказал уборку квартиры и оплатил услугу. Работы выполнены клининговой компанией. Квартира приведена в порядок.
0|site.ru/house-164|Залог|Жилье|Внес залог за аренду квартиры. Средства будут возвращены после окончания договора. Это стандартное условие аренды.
0|site.ru/house-165|Риелтор|Жилье|Оплатил услуги риелтора. Специалист помог подобрать жилье. Комиссия оплачивается один раз.
0|site.ru/house-167|Мусор|Жилье|Оплатил вывоз мусора. Услуга входит в коммунальные платежи. Начисление производится регулярно.
0|site.ru/house-168|Домофон|Жилье|Заплатил за обслуживание домофона. Платеж небольшой, но обязательный. Устройство обеспечивает доступ в подъезд.
0|site.ru/house-169|Лифт|Жилье|Оплатил обслуживание лифта. Включено в содержание дома. Платеж начисляется ежемесячно.
0|site.ru/house-170|Двор|Жилье|Оплатил благоустройство дворовой территории. Работы включают уборку и озеленение. Это часть коммунальных услуг.
0|site.ru/house-171|Студия|Жилье|Внес оплату за аренду квартиры-студии. Жилье компактное и удобное. Платеж произведен вовремя.
0|site.ru/house-172|Хостел|Жилье|Оплатил проживание в хостеле. Это бюджетный вариант жилья. Подходит для краткосрочного размещения.
0|site.ru/house-173|Отель|Жилье|Заплатил за проживание в отеле. Номер был забронирован заранее. Платеж произведен полностью.
0|site.ru/house-174|Посуточная аренда|Жилье|Снял квартиру посуточно и оплатил проживание. Услуга оформлена через сервис. Заселение прошло без проблем.
0|site.ru/house-175|Страховка ипотеки|Жилье|Оплатил страховку по ипотечному договору. Это обязательное условие банка. Платеж производится ежегодно.
0|site.ru/house-176|Налог|Жилье|Заплатил налог на недвижимость. Сумма рассчитана по кадастровой стоимости. Платеж выполнен в срок.
0|site.ru/house-177|Гараж|Жилье|Оплатил аренду гаража. Используется для хранения автомобиля. Платеж производится ежемесячно.
0|site.ru/house-178|Обслуживание|Жилье|Заплатил управляющей компании за обслуживание дома. Включает ремонт и технические работы. Это регулярный расход.
0|site.ru/house-179|Окна|Жилье|Заказал услугу мытья окон. Оплатил работу специалистов. Квартира стала чище и светлее.
0|site.ru/house-180|Дезинфекция|Жилье|Оплатил обработку квартиры от насекомых. Работы выполнены специализированной службой. Это разовый расход.
0|site.ru/house-181|Интернет подключение|Жилье|Заплатил за подключение интернета. Мастер выполнил настройку оборудования. Услуга оказана полностью.
0|site.ru/house-184|Пени|Жилье|Заплатил пени за просрочку коммунальных платежей. Сумма небольшая. В дальнейшем буду оплачивать вовремя.
0|site.ru/house-185|Подъезд|Жилье|Оплатил уборку подъезда. Услуга входит в содержание дома. Поддерживается чистота.
0|site.ru/house-186|Снег|Жилье|Заплатил за уборку снега во дворе. Это сезонная услуга. Обеспечивает безопасное передвижение.
0|site.ru/house-187|Аренда|Жилье|Внес оплату за аренду жилья. Перевод выполнен владельцу. Это регулярный ежемесячный расход.
0|site.ru/house-188|Коммуналка|Жилье|Оплатил коммунальные счета. Включены основные услуги. Платеж выполнен через интернет-банк.
0|site.ru/house-189|Ипотека|Жилье|Внес очередной платеж по ипотеке. Средства списаны автоматически. Обязательство выполнено.
0|site.ru/house-190|Интернет|Жилье|Оплатил услуги интернета. Подключение необходимо для работы. Платеж произведен заранее.
0|site.ru/slang-144|Посуточно|Жилье|Снял хату посуточно, оплатил сразу. Быстро заселился. Удобно, когда ненадолго.
0|site.ru/home-1|Покупка стиральной машины|Быт|Приобрел стиральную машину для дома. Оплата произведена банковской картой. Это разовый крупный расход.
0|site.ru/home-2|Холодильник|Быт|Купил холодильник для кухни. Выбрал модель среднего ценового сегмента. Оплата выполнена онлайн.
0|site.ru/home-3|Пылесос|Быт|Приобрел пылесос для уборки квартиры. Устройство облегчает повседневные задачи. Оплата произведена в магазине.
0|site.ru/home-4|Микроволновая печь|Быт|Купил микроволновую печь. Устройство используется для разогрева пищи. Платеж выполнен картой.
0|site.ru/home-5|Электрический чайник|Быт|Приобрел электрический чайник. Это необходимый бытовой прибор. Оплата произведена сразу.
0|site.ru/home-6|Утюг|Быт|Купил утюг для ухода за одеждой. Устройство выбрано по характеристикам. Оплата выполнена наличными.
0|site.ru/home-7|Кондиционер|Быт|Установил кондиционер в квартире. Оплатил как устройство, так и монтаж. Это значительный расход.
0|site.ru/home-8|Обогреватель|Быт|Приобрел обогреватель для холодного сезона. Устройство используется регулярно. Оплата произведена онлайн.
0|site.ru/home-9|Посудомоечная машина|Быт|Купил посудомоечную машину. Она позволяет экономить время на уборке. Платеж выполнен через интернет.
0|site.ru/home-10|Кофемашина|Быт|Приобрел кофемашину для дома. Устройство используется ежедневно. Оплата произведена банковской картой.
0|site.ru/home-11|Фен|Быт|Купил фен для личного использования. Устройство компактное и удобное. Оплата произведена в магазине.
0|site.ru/home-12|Тостер|Быт|Приобрел тостер для кухни. Используется для приготовления завтрака. Оплата выполнена онлайн.
0|site.ru/home-13|Блендер|Быт|Купил блендер для приготовления пищи. Устройство облегчает процесс готовки. Платеж произведен картой.
0|site.ru/home-14|Мультиварка|Быт|Приобрел мультиварку. Устройство позволяет готовить различные блюда. Оплата произведена через интернет.
