num|url|title|category|data
0|site.ru/fash-370|Колготки|Одежда|Взял плотные колготки. На улице уже прохладно.
0|site.ru/fash-371|Чулки|Одежда|Купил чулки под платье. Нужны были к мероприятию.
0|site.ru/fash-372|Бюстгальтер|Одежда|Взял новое белье. Старое уже потеряло форму.
0|site.ru/fash-373|Купальник|Одежда|Купил купальник перед отпуском. Для моря пригодится.
0|site.ru/fash-374|Плавки|Одежда|Взял плавки для бассейна. Обычная покупка.
0|site.ru/fash-375|Кальсоны|Одежда|Купил теплые кальсоны на зиму. Очень выручают в мороз.
0|site.ru/fash-376|Домашние тапки|Одежда|Взял тапочки для дома. Старые уже стерлись.
0|site.ru/fash-377|Мокасины|Одежда|Купил мокасины для лета. Легкие и удобные.
0|site.ru/fash-378|Лоферы|Одежда|Взял лоферы под деловой стиль. Хорошо смотрятся.
0|site.ru/fash-379|Оксфорды|Одежда|Купил классические оксфорды. Для костюма отлично подходят.
0|site.ru/fash-380|Броги|Одежда|Взял броги на осень. Нравится такой стиль обуви.
0|site.ru/fash-381|Челси|Одежда|Купил ботинки челси. Очень удобные и стильные.
0|site.ru/fash-382|Берцы|Одежда|Взял берцы для походов. Крепкая обувь.
0|site.ru/fash-383|Угги|Одежда|Купил угги на зиму. В них очень тепло.
0|site.ru/fash-384|Валенки|Одежда|Взял валенки для дачи. В морозы спасают отлично.
0|site.ru/fash-385|Резиновые сапоги|Одежда|Купил резиновые сапоги. Для дождя и грязи самое то.
0|site.ru/fash-386|Кроссы|Одежда|Взял новые кроссы. Старые уже убились полностью.
0|site.ru/fash-387|Хайпы|Одежда|Купил хайповую одежду. Сейчас такой стиль в моде.
0|site.ru/fash-389|Шмотки|Одежда|Купил новые шмотки. Гардероб давно хотел обновить.
0|site.ru/fash-391|Зип-худи|Одежда|Купил худи на молнии. Удобно носить каждый день.
0|site.ru/fash-392|Олимпийка|Одежда|Взял олимпийку в спортивном стиле. Нормальная тема.
0|site.ru/fash-393|Рашгард|Одежда|Купил рашгард для тренировок. Хорошо сидит по телу.
0|site.ru/fash-394|Тайтсы|Одежда|Взял тайтсы для бега. Комфортно заниматься спортом.
0|site.ru/fash-395|Кроп-топ|Одежда|Купил кроп-топ на лето. Легкая модная вещь.
0|site.ru/fash-396|Пончо|Одежда|Взял пончо для дождливой погоды. Выглядит необычно.
0|site.ru/fash-397|Кимоно|Одежда|Купил кимоно для тренировок. Нужно для занятий.
0|site.ru/fash-398|Смокинг|Одежда|Взял смокинг для торжественного мероприятия.
0|site.ru/fash-399|Фрак|Одежда|Купил фрак для выступления. Редкая, но нужная вещь.
0|site.ru/fash-400|Бабочка|Одежда|Взял галстук-бабочку под костюм. Для праздника подойдет.
0|site.ru/fash-401|Худак|Одежда|Купил новый худак на повседневку. Теплый и удобный.
0|site.ru/fash-402|Кофта|Одежда|Взял обычную кофту. На каждый день нормально.
0|site.ru/fash-404|Шмотки|Одежда|Купил новые шмотки. Старые уже надоели.
0|site.ru/fash-405|Тишка|Одежда|Взял пару тишек на лето. Простые базовые футболки.
0|site.ru/fash-406|Футба|Одежда|Купил белую футбу. Под все подходит.
0|site.ru/fash-407|Зипка|Одежда|Взял зипку на молнии. Удобно носить весной.
0|site.ru/fash-408|Свишот|Одежда|Купил свишот оверсайз. Сейчас такие в моде.
0|site.ru/fash-409|Оверсайз|Одежда|Взял пару оверсайз вещей. Люблю свободный стиль.
0|site.ru/fash-410|Штаны|Одежда|Купил новые штаны. Старые уже порвались.
0|site.ru/fash-411|Треники|Одежда|Взял треники для дома и улицы. Максимально удобно.
0|site.ru/fash-412|Спортики|Одежда|Купил спортивки для прогулок. Мягкие и комфортные.
0|site.ru/fash-413|Джинса|Одежда|Взял темную джинсу на каждый день.
0|site.ru/fash-414|Рваные джинсы|Одежда|Купил рваные джинсы. Захотелось что-то молодежное.
0|site.ru/fash-415|Карго|Одежда|Взял карго со множеством карманов. Практичная тема.
0|site.ru/fash-416|Шортики|Одежда|Купил легкие шортики на жару.
0|site.ru/fash-417|Кроссы|Одежда|Взял новые кроссы. Старые уже стерлись.
0|site.ru/fash-418|Кеды|Одежда|Купил кеды под повседневный стиль.
0|site.ru/fash-419|Форсы|Одежда|Взял новые форсы. Давно хотел именно эту модель.
0|site.ru/fash-420|Найки|Одежда|Купил найки для прогулок и тренировок.
0|site.ru/fash-421|Адики|Одежда|Взял адики на каждый день. Очень удобные.
0|site.ru/fash-422|Палёный шмот|Одежда|Купил палёный шмот на рынке. Дешево вышло.
0|site.ru/fash-423|Реплика кроссовок|Одежда|Взял реплику брендовых кроссовок. Внешне норм.
0|site.ru/fash-424|База|Одежда|Купил базу на каждый день. Простые вещи без принтов.
0|site.ru/fash-427|Кэжуал|Одежда|Купил одежду в casual стиле. Для повседневки отлично.
0|site.ru/fash-428|Стритвир|Одежда|Взял пару вещей в стиле streetwear.
0|site.ru/fash-429|Паль|Одежда|Купил паль вместо оригинала. Для повседневки сойдет.
0|site.ru/fash-431|Бомбер|Одежда|Купил бомбер под осень. Сейчас такие носят все.
0|site.ru/fash-432|Ветровка|Одежда|Взял легкую ветровку. Для вечерних прогулок.
0|site.ru/fash-433|Безрукавка|Одежда|Купил безрукавку на прохладную погоду.
0|site.ru/fash-434|Тапки|Одежда|Взял домашние тапки. Старые уже развалились.
0|site.ru/fash-435|Сланцы|Одежда|Купил сланцы для бассейна и отпуска.
0|site.ru/fash-436|Панамка|Одежда|Взял панамку на лето. Спасает от солнца.
0|site.ru/fash-437|Бини|Одежда|Купил шапку-бини. Подходит под любой стиль.
0|site.ru/fash-438|Носки|Одежда|Взял пачку носков. Постоянно теряются.
0|site.ru/fash-439|Терма|Одежда|Купил терму на холодную погоду. Очень выручает зимой.
0|site.ru/fash-440|Домашка|Одежда|Взял домашку для дома. Максимально комфортная одежда.
0|site.ru/fash-441|Пухан|Одежда|Купил теплый пухан на зиму. Морозы переживет спокойно.
0|site.ru/fash-442|Косуха|Одежда|Взял косуху под осенний стиль. Давно хотел такую.
0|site.ru/fash-443|Кепарь|Одежда|Купил кепарь для прогулок. Простая повседневная вещь.
0|site.ru/fash-444|Шапка|Одежда|Взял новую шапку. Старая уже растянулась.
0|site.ru/fash-445|Шарфик|Одежда|Купил теплый шарфик. На улице стало холодно.
0|site.ru/fash-446|Перчи|Одежда|Взял зимние перчи. Без них руки мерзнут.
0|site.ru/fash-447|Бельё|Одежда|Купил новое бельё. Обычная бытовая покупка.
0|site.ru/fash-448|Домашний костюм|Одежда|Взял домашний костюм для отдыха дома.
0|site.ru/fash-449|Спортивный сет|Одежда|Купил спортивный сет для тренировок.
0|site.ru/fash-451|Nike|Одежда|Купил одежду Nike для тренировок. Качество как обычно нормальное.
0|site.ru/fash-452|Найк|Одежда|Взял новый найк на каждый день. Удобно сидит.
0|site.ru/fash-453|Найки|Одежда|Купил найки для спорта и прогулок.
0|site.ru/fash-454|Adidas|Одежда|Взял вещи Adidas на распродаже. Хороший спорт стиль.
0|site.ru/fash-455|Адики|Одежда|Купил адики под повседневный стиль.
0|site.ru/fash-456|Puma|Одежда|Взял кроссовки Puma. Удобные и легкие.
0|site.ru/fash-457|Пума|Одежда|Купил пуму для тренировок. Нормальная обувь.
0|site.ru/fash-458|Reebok|Одежда|Взял новые Reebok для зала.
0|site.ru/fash-459|Рибоки|Одежда|Купил рибоки на каждый день.
0|site.ru/fash-460|New Balance|Одежда|Взял New Balance для долгих прогулок.
0|site.ru/fash-461|Нюбы|Одежда|Купил нюбы, очень удобные для ходьбы.
0|site.ru/fash-462|Converse|Одежда|Взял классические Converse под джинсы.
0|site.ru/fash-463|Конверсы|Одежда|Купил конверсы на лето.
0|site.ru/fash-464|Vans|Одежда|Взял Vans для повседневной носки.
0|site.ru/fash-465|Вансы|Одежда|Купил вансы под стритвир стиль.
0|site.ru/fash-466|Jordan|Одежда|Взял кроссовки Jordan. Давно хотел эту модель.
0|site.ru/fash-467|Джорданы|Одежда|Купил джорданы для коллекции и прогулок.
0|site.ru/fash-468|Air Force|Одежда|Взял Air Force в белом цвете. База на каждый день.
0|site.ru/fash-469|Форсы|Одежда|Купил форсы, классика под любой лук.
0|site.ru/fash-470|Yeezy|Одежда|Взял Yeezy по скидке. Очень удобные кроссовки.
0|site.ru/fash-471|Изи|Одежда|Купил изи для повседневки. Мягкие и комфортные.
0|site.ru/fash-472|Balenciaga|Одежда|Взял худи Balenciaga. Дорогой, но стильный шмот.
0|site.ru/fash-473|Баленсиага|Одежда|Купил баленсиагу ради оверсайз стиля.
0|site.ru/fash-474|Supreme|Одежда|Взял Supreme на перепродаже.
0|site.ru/fash-475|Суприм|Одежда|Купил суприм худи. Хотел хайповую вещь.
0|site.ru/fash-476|Stone Island|Одежда|Взял Stone Island на осень. Качественная одежда.
0|site.ru/fash-477|Стоник|Одежда|Купил стоник с патчем. Давно хотел.
0|site.ru/fash-478|The North Face|Одежда|Взял куртку The North Face на зиму.
0|site.ru/fash-479|Нортфейс|Одежда|Купил нортфейс пуховик. Очень теплый.
0|site.ru/fash-480|Columbia|Одежда|Взял Columbia для активного отдыха.
0|site.ru/fash-481|Коламбия|Одежда|Купил коламбию для поездок и прогулок.
0|site.ru/fash-482|Tommy Hilfiger|Одежда|Взял Tommy Hilfiger на скидках.
0|site.ru/fash-483|Томми|Одежда|Купил томми футболку на каждый день.
0|site.ru/fash-484|Ralph Lauren|Одежда|Взял Ralph Lauren для более классического стиля.
0|site.ru/fash-485|Ральф|Одежда|Купил ральф поло. Выглядит аккуратно.
0|site.ru/fash-486|Lacoste|Одежда|Взял Lacoste поло на лето.
0|site.ru/fash-487|Лакоста|Одежда|Купил лакосту под casual стиль.
0|site.ru/fash-488|Zara|Одежда|Взял вещи Zara на сезон. Простая база.
0|site.ru/fash-489|Зара|Одежда|Купил зару для офиса и повседневки.
0|site.ru/fash-490|H&M|Одежда|Взял базовые вещи в H&M. Недорого и нормально.
0|site.ru/fash-491|Эйчэндэм|Одежда|Купил пару футболок в эйчэндэме.
0|site.ru/fash-492|Uniqlo|Одежда|Взял базу в Uniqlo. Хорошие повседневные вещи.
0|site.ru/fash-493|Юник|Одежда|Купил юник на каждый день. Простая удобная одежда.
0|site.ru/fash-494|Pull&Bear|Одежда|Взял одежду Pull&Bear для прогулок.
0|site.ru/fash-495|Пул|Одежда|Купил вещи в пуле. Молодежный стиль.
0|site.ru/fash-496|Bershka|Одежда|Взял Bershka на лето. Недорогие вещи.
0|site.ru/fash-497|Бершка|Одежда|Купил бершку для повседневки.
0|site.ru/fash-498|Crocs|Одежда|Взял Crocs для дома и дачи.
0|site.ru/fash-499|Кроксы|Одежда|Купил кроксы, максимально удобные.
0|site.ru/fash-500|Gucci|Одежда|Взял Gucci аксессуар. Дорогая, но статусная покупка.
0||личная трата|Транспорт|Взял такси до офиса, поездка вышла недорого
0||личная трата|Транспорт|Вызвал Яндекс такси домой после работы
0||личная трата|Транспорт|Прокатился на самокате по городу
0||личная трата|Транспорт|Взял прокатный самокат на несколько минут
0||личная трата|Транспорт|Поехал на маршрутке в сторону центра
0||личная трата|Транспорт|Оплатил проезд в автобусе
0||личная трата|Транспорт|Купил талоны на автобус на месяц
0||личная трата|Транспорт|Пополнил транспортную карту
0||личная трата|Транспорт|Заплатил за поездку в метро
0||личная трата|Транспорт|Купил проездной на месяц
0||личная трата|Транспорт|Оплатил проезд в троллейбусе
0||личная трата|Транспорт|Оплатил парковку в центре
0||личная трата|Транспорт|Взял каршеринг на пару часов
0||личная трата|Транспорт|Арендовал велосипед на день
0||личная трата|Транспорт|Прокатился на велике через парк
0||личная трата|Транспорт|Купил билет на поезд
0||личная трата|Транспорт|Оплатил трамвай до остановки
0||личная трата|Транспорт|Взял такси в аэропорт
0||личная трата|Транспорт|Вызвал такси через приложение
0||личная трата|Транспорт|Поехал на работу на такси
0||личная трата|Транспорт|Купил скутер мопед на прокат
0||личная трата|Транспорт|Взял велосипед напрокат в парке
0||личная трата|Транспорт|Заплатил за проезд в маршрутке
0||личная трата|Транспорт|Оплатил поездку в метро через телефон
0||личная трата|Транспорт|Купил билет на автобус
0||личная трата|Транспорт|Потратил на дорогу до учебы
0||личная трата|Транспорт|Прокатился на городском самокате
0||личная трата|Транспорт|Оплатил бензин на трассе
0||личная трата|Транспорт|Заплатил за стоянку машины
0||личная трата|Транспорт|Купил месячный проездной на транспорт
0||личная трата|Транспорт|Взял uber до торгового центра
0||личная трата|Транспорт|Оплатил проезд картой в троллейбусе
0||личная трата|Транспорт|Поехал в колледж на автобусе
0||личная трата|Транспорт|Взял каршеринг на выходные
0|site.ru/tech-501|Смартфон|Техника|Приобрел новый смартфон. Старое устройство уже работало медленно.
0|site.ru/tech-502|Ноутбук|Техника|Купил ноутбук для работы и учебы. Производительности хватает.
0|site.ru/tech-503|Планшет|Техника|Взял планшет для просмотра видео и чтения документов.
0|site.ru/tech-505|Монитор|Техника|Купил монитор с большим экраном. Удобно работать.
0|site.ru/tech-506|Клавиатура|Техника|Приобрел механическую клавиатуру. Печатать стало комфортнее.
0|site.ru/tech-507|Мышь|Техника|Купил беспроводную мышь для ноутбука.
0|site.ru/tech-508|Наушники|Техника|Взял новые наушники для музыки и звонков.
0|site.ru/tech-509|Колонка|Техника|Купил портативную колонку. Звук достаточно громкий.
0|site.ru/tech-510|Микрофон|Техника|Приобрел микрофон для записи голоса и общения.
0|site.ru/tech-511|Веб-камера|Техника|Купил веб-камеру для видеоконференций.
0|site.ru/tech-512|Принтер|Техника|Взял принтер для печати документов дома.
0|site.ru/tech-513|Сканер|Техника|Купил сканер для оцифровки документов.
0|site.ru/tech-514|Роутер|Техника|Приобрел новый роутер для стабильного интернета.
0|site.ru/tech-515|Модем|Техника|Взял модем для подключения сети за городом.
0|site.ru/tech-516|Жесткий диск|Техника|Купил внешний жесткий диск для хранения файлов.
0|site.ru/tech-517|SSD накопитель|Техника|Приобрел SSD для ускорения работы компьютера.
0|site.ru/tech-518|Флешка|Техника|Купил USB-накопитель для переноса данных.
0|site.ru/tech-519|Power Bank|Техника|Взял внешний аккумулятор для зарядки телефона.
0|site.ru/tech-520|Зарядное устройство|Техника|Купил новое зарядное устройство для смартфона.
0|site.ru/tech-521|Кабель USB|Техника|Приобрел кабель для зарядки и передачи данных.
0|site.ru/tech-522|Умные часы|Техника|Купил смарт-часы для уведомлений и спорта.
0|site.ru/tech-523|Фитнес-браслет|Техника|Взял фитнес-браслет для отслеживания активности.
0|site.ru/tech-524|Электронная книга|Техника|Купил ридер для чтения книг в дороге.
0|site.ru/tech-525|Игровая приставка|Техника|Приобрел игровую консоль для домашнего отдыха.
0|site.ru/tech-526|Геймпад|Техника|Купил дополнительный геймпад для приставки.
0|site.ru/tech-527|VR-шлем|Техника|Взял шлем виртуальной реальности для игр.
0|site.ru/tech-528|Фотоаппарат|Техника|Купил цифровой фотоаппарат для съемки поездок.
0|site.ru/tech-529|Видеокамера|Техника|Приобрел видеокамеру для записи мероприятий.
0|site.ru/tech-530|Дрон|Техника|Купил квадрокоптер для съемки с воздуха.
0|site.ru/tech-531|Проектор|Техника|Взял проектор для просмотра фильмов дома.
0|site.ru/tech-532|Телевизор|Техника|Купил новый телевизор с большим экраном.
0|site.ru/tech-533|Саундбар|Техника|Приобрел саундбар для улучшения звука телевизора.
0|site.ru/tech-534|Домашний кинотеатр|Техника|Купил акустическую систему для фильмов.
0|site.ru/tech-535|MP3-плеер|Техника|Взял плеер для прослушивания музыки в дороге.
0|site.ru/tech-536|Радиоприемник|Техника|Купил компактный радиоприемник для дачи.
0|site.ru/tech-537|Стабилизатор|Техника|Приобрел стабилизатор для съемки видео.
0|site.ru/tech-538|Штатив|Техника|Купил штатив для камеры и телефона.
0|site.ru/tech-539|Графический планшет|Техника|Взял графический планшет для рисования.
0|site.ru/tech-540|Сервер|Техника|Приобрел серверное оборудование для работы.
0|site.ru/tech-541|Материнская плата|Техника|Купил новую материнскую плату для компьютера.
0|site.ru/tech-542|Видеокарта|Техника|Приобрел видеокарту для обработки графики.
0|site.ru/tech-543|Процессор|Техника|Купил процессор для обновления системы.
0|site.ru/tech-544|Оперативная память|Техника|Взял дополнительную оперативную память.
0|site.ru/tech-545|Система охлаждения|Техника|Купил кулер для стабильной работы компьютера.
0|site.ru/tech-546|Корпус ПК|Техника|Приобрел новый корпус для компьютера.
0|site.ru/tech-547|Блок питания|Техника|Купил блок питания с запасом мощности.
0|site.ru/tech-548|Wi-Fi адаптер|Техника|Взял адаптер для беспроводного подключения.
0|site.ru/tech-549|USB-хаб|Техника|Купил USB-разветвитель для подключения устройств.
0|site.ru/tech-550|Карта памяти|Техника|Приобрел карту памяти для телефона и камеры.
0|site.ru/tech-551|Док-станция|Техника|Приобрел док-станцию для подключения периферии к ноутбуку.
0|site.ru/tech-552|HDMI-сплиттер|Техника|Купил HDMI-разветвитель для подключения нескольких экранов.
0|site.ru/tech-553|Картридер|Техника|Взял устройство для чтения карт памяти.
0|site.ru/tech-554|ИБП|Техника|Приобрел источник бесперебойного питания для компьютера.
