num|url|title|category|data
0|https://tabu.relax.by/#reviews|TABU|Ресторан и еда|Атмосферное место, где вкусная еда, авторские коктейли и настольные игры
0|https://glass.relax.by/#reviews|GLASS BAR|Ресторан и еда|Лаунж-бар с летней террасой для ценителей яркой ночной жизни и непринужденного отдыха
0|https://sochi-rest.relax.by/#reviews|Сочи|Ресторан и еда|Ресторан приглашает насладиться сочной кухней в окружении гостеприимной атмосферы и внимательного персонала
0|https://the-one.relax.by/#reviews|The One|Ресторан и еда|Ресторан в Минске, метро Немига. Европейская кухня днём, танцы ночью! Ждём вас для ярких эмоций и незабываемых вечеров.
0|https://rio-restaurant.relax.by/#reviews|Рио|Ресторан и еда|Атмосферный стейк-хаус с блюдами бразильской и европейской кухонь в формате шведского стола
0|https://chumatskiy-shlyakh.relax.by/#reviews|Чумацький шлях|Ресторан и еда|По-домашнему уютная атмосфера, доброжелательный персонал, внимательный сервис и профессиональное обслуживание
0|https://staromestnyj-pivovar.relax.by/#reviews|Староместный пивовар|Ресторан и еда|«Староместный пивовар» — авторская кухня, крафтовые напитки, уютная атмосфера в историческом центре Минска.
0|https://osobnyak.relax.by/#reviews|ОСОБНЯК|Ресторан и еда|Трехэтажный гастропаб с караоке и авторской кухней
0|https://gan-bei.relax.by/#reviews|Gan Bei|Ресторан и еда|Сеть ресторанов паназиатской и европейской кухни с качественными продуктами, вкусными блюдами, профессиональной командой
0|https://cuprum.relax.by/#reviews|CUPRUM Smoked BBQ|Ресторан и еда|Качественная музыка, вкусная еда, достойный выбор напитков, уединенная атмосфера
0|https://jungle-lounge.relax.by/#reviews|Jungle Lounge Cafe|Ресторан и еда|Современная площадка с особенным форматом отдыха
0|https://rest-usadba.relax.by/#reviews|Усадьба|Ресторан и еда|Ресторан, созданный для людей c искушенным вкусом, что бы вы ни попробовали, вы выбираете блюда премиум-качества.
0|https://nastroenie-est.relax.by/#reviews|Настроение есть|Ресторан и еда|Гастробар «Настроение есть» в Минске — уютное место с авторской кухней, панорамными окнами и атмосферой городского уюта
0|https://bonshans.relax.by/#reviews|Бон Шанс|Ресторан и еда|Ресторан в Минске: разнообразная европейская кухня, элегантный интерьер и гостеприимство. Идеален для встреч и торжеств
0|https://1884deurope.relax.by/#reviews|1884 D'Europe|Ресторан и еда|Авторское прочтение традиций французской кухни в отеле «Европа» в самом центре города
0|https://klaus.relax.by/#reviews|Klaus|Ресторан и еда|Аутентичное кафе с настоящей итальянской пастой, пиццей и хорошим вином
0|https://renaissance-banket.relax.by/#reviews|Renaissance Minsk|Ресторан и еда|Отель с банкетными залами в центре Минска, вместимостью до 600 человек, трансформируемым залом и кейтерингом на заказ
0|https://cafe-berezka.relax.by/#reviews|Берёзка|Ресторан и еда|Новое воплощение легендарного кафе под шефством Golden Project
0|https://korchma-minsk.relax.by/#reviews|Корчма Старовиленская|Ресторан и еда|Традиционная белорусская корчма в живописном Троицком предместье
0|https://locanda-babushka-chic.relax.by/#reviews|Locanda Бабушка Chic|Ресторан и еда|Ресторан Locanda Бабушка Chic в центре Минска — итальянская кухня, уютный интерьер и камерные праздники
0|https://yar-minsk.relax.by/#reviews|Яр|Ресторан и еда|Стильный ресторан с атмосферой буржуа, оригинальной кухней и развлечениями
0|https://maslow6.relax.by/#reviews|Maslow6|Ресторан и еда|Авторская европейская кухня. Элегантная винная карта или авторская коктейльная — решать вам, мы лишь деликатно аккомпанируем
0|https://westfalia-minsk.relax.by/#reviews|Вестфалия|Ресторан и еда|Три банкетных зала и внутренний дворик для любителей немецкой кухни
0|https://daclaudio.relax.by/#reviews|Da Claudio|Ресторан и еда|Аутентичный ресторан итальянской кухни, окруженный особым уютом, гостеприимством и радушием
0|https://stvolhouse.relax.by/#reviews|Stvol House|Ресторан и еда|Концептуальный и атмосферный рестобар с разнообразной авторской кухней и душевным интерьером
0|https://bierkeller-minsk.relax.by/#reviews|BierKeller|Ресторан и еда|Немецкий пивной погребок с аутентичной атмосферой, отменными хмельными напитками и сытными блюдами немецкой кухни
0|https://bar-kvartirnik.relax.by/#reviews|Квартирник|Ресторан и еда|Караоке в центре Минска – уютное место с камерной атмосферой, авторской кухней и интерьером в ретро-стиле
0|https://mziuri.relax.by/#reviews|Мзиури|Ресторан и еда|Арт-ресторан — грузинская кухня, искусство и уют во Фрунзенском районе Минска, рядом ст. м. Каменная горка
0|https://rest-tiflis.relax.by/#reviews|Tiflis (Тифлисъ)|Ресторан и еда|Душевная грузинская кухня возле парка Челюскинцев
0|https://chajna-merchante.relax.by/#reviews|Чайна Мерчантс|Ресторан и еда|Ресторан и гостиница недалеко от Минска: сочетание комфорта и восточного гостеприимства
0|https://woodfire-rest.relax.by/#reviews|Wood & Fire|Ресторан и еда|Европейский модерн, стейки на раскаленном мраморе и DJ-этаж недалеко от Национальной библиотеки
0|https://seasons.relax.by/#reviews|Сезоны|Ресторан и еда|Ресторан в Минске: блюда китайской кухни, атмосфера с элементами искусства и возможность банкетного обслуживания
0|https://fornello.relax.by/#reviews|Fornello|Ресторан и еда|Элегантная итальянская траттория в Minsk Marriott Hotel
0|https://silverspoon.relax.by/#reviews|Серебряная Ложка|Ресторан и еда|Уютное местечко для душевных встреч с близкими и ценная находка для празднования торжеств. Банкеты до 150 гостей
0|https://rakovskij-brovar.relax.by/#reviews|Раковский бровар|Ресторан и еда|Обстоятельный ресторан-пивоварня с крафтовыми сортами и традиционной кухней в Раковском предместье
0|https://honky-tonk.relax.by/#reviews|Honky Tonk Piano Bar|Ресторан и еда|Рестобар в центре города, с авторской кухней, уникальной атмосферой, живой музыкой и огромным выбором напитков
0|https://rest-amsterdam.relax.by/#reviews|Амстердам|Ресторан и еда|Яркий фьюжн, европейская и азиатская кухни с панорамным видом на Дворец Независимости
0|https://myata-lounge-mira.relax.by/#reviews|Мята Lounge|Ресторан и еда|Lounge в Минске – стильное место с уютной атмосферой, изысканной кухней, авторскими коктейлями и отличным обслуживанием
0|https://eda.ru/recepty/zavtraki/amerikanskie-pankejki-s-koricej-31193|Американские панкейки с корицей|Ресторан и еда|Панкейки — пирожные на сковородке, если перевести, — круглые пышные блинчики, которые принято складывать стопочкой по четыре-пять штук на порцию, поливать кленовым сиропом или растопленным сливочным маслом и есть на завтрак. Тесто для панкейков, правда, готовится не слишком быстро: чтобы добиться правильной пористой структуры, придется отдельно взбивать белки. В этот рецепт для выразительности добавили корицу, а так панкейки можно делать самых разнообразных вкусов — например, добавляя банановое пюре или какао.
0|https://eda.ru/recepty/salaty/salat-iz-krasnoj-fasoli-s-tvorozhnim-sirom-krasnim-lukom-i-sezonnim-salatom-16922|Салат из красной фасоли с творожным сыром, красным луком и сезонным салатом|Ресторан и еда|Тосканский салат, выдержанный в колористике итальянского флага. Буквально нескольких ложек хватает, чтобы в желудке образовалась приятная тяжесть. Очень полезная штука с точки зрения утра, когда трудно запихнуть в себя крупные дозы биомассы, а есть при этом хочется. Кроме рукколы в этом салате уверенно чувствуют себя листья корн-салата и щавеля, но идеальнее всего ведет себя зеленая черемша. Используя ее, можно, кстати, отказаться от чеснока. Этот салат вообще допускает множество сюжетных отклонений. Например, вместо соли можно использовать соевый соус: в сочетании с фасолью он очень уместен. А для пущего благообразия можно капнуть в миску немного бальзамического уксуса.
0|https://eda.ru/recepty/zakuski/brusketta-s-pomidorami-29566|Брускетта с помидорами|Ресторан и еда|Брускетта с помидорами – вкусная итальянская закуска, а также простейший способ положить что-то на зуб, почувствовать легкую сытость, но обойтись при этом без переедания. Кроме того, брускетты всегда выглядят очень нарядно. И приготовление их занимает минимум времени. Самое популярное сочетание —поджаренный хлеб, помидоры, чеснок и базилик. Если нет времени бланшировать помидоры на сковороде, можно заменить их на вяленые томаты. Для приготовления итальянской брускетты лучше взять чиабатту — ее ломтики после поджарки хорошо впитают оливковое масло.
0|https://eda.ru/recepty/vypechka-deserty/kapustnij-pirog-17889|Пирог с капустой|Ресторан и еда|Еще одна бронебойная закуска — горячая или холодная, в зависимости от вашего желания. Один из немногих пирогов, которые не сильно уступают самим себе на следующий день или даже через день после приготовления.
0|https://eda.ru/recepty/zakuski/guakamole-30239|Гуакамоле|Ресторан и еда|Гуакамоле как закуска, — или как соус, кому что ближе — традиционно известна в мексиканской кухне, но очень популярна во всем мире. Главное, найти хороший спелый авокадо и непременно размять мякоть с соком лимона или лайма — с этим нехитрым действием блюдо сохраняет свой зеленый цвет и не превращается в нечто непривлекательное. Консистенция же может быть разной: если разминать вилкой, получится закуска с кусочками ингредиентов, если смешать все в блендере — соус, который отлично подойдет ко многим основным блюдам.
0|https://eda.ru/recepty/zavtraki/bananovie-pankejki-35975|Банановые панкейки|Ресторан и еда|Банановые панкейки — не менее традиционный вариант американских блинчиков (или оладий, кто как больше привык), обязательный и очень вкусный элемент американского завтрака. Готовить их следует на сухой сковороде. Чтобы процесс приготовления происходил быстрее, многие хозяйки покупают специальные сковороды: в них уже есть формочки под три или шесть блинчиков — в зависимости от размера. Для теста следует взять слегка перезрелые бананы. Готовые оладушки можно поливать как кленовым сиропом, так и обычным медом.
0|https://eda.ru/recepty/salaty/salat-s-krevetkami-kunzhutom-21742|Салат с креветками и кунжутом|Ресторан и еда|Салат с креветками и кунжутом прост и лаконичен, поскольку эти морепродукты сами по себе не нуждаются в лишнем сопровождении. Майонез в салате можно заменить на натуральный йогурт или оливковое масло, смешанное с лимонным соком. А дополнить блюдо — крупно нарезанным авокадо и тертым пармезаном. Сами креветки можно приготовить тремя путями: отварить, запечь или поджарить. Главное, не делать это долгое время. При каждой из этих обработок вкус креветок будет меняться по-разному, но менее привлекательным от этого не станет.
0|https://eda.ru/recepty/osnovnye-blyuda/graten-dofinua-17587|Гратен дофинуа|Ресторан и еда|Спагетти с чесноком и маслом — простое и вкусное блюдо с историей. В средневековой Италии практиковали своего рода «раздельное питание»: феодалы ели мясо, а крестьянам приходилось изобретать блюда из того, что было под рукой. Классический рецепт пасты алио-олио (спагетти с чесноком и маслом) — наследие того времени. Замечательна она тем, что из минимума компонентов получается ароматное и насыщенное вкусами блюдо, а приготовить его совсем несложно.
0|https://eda.ru/recepty/zavtraki/frittata-s-brokkoli-sladkim-percem-17602|Фриттата с брокколи и сладким перцем|Ресторан и еда|Фриттата с брокколи и сладким перцем — классический итальянский омлет. Главный ингредиент здесь не яйца, а крупно нарезанные овощи, поэтому их должно быть много. Яйца только фиксируют конструкцию. Получается объемное, рельефное и красивое блюдо. Фриттата сначала жарится на сковороде, а потом отправляется в духовку — чтобы застыла серединка, и края при этом не пересушились. Если духовки нет, плотно накройте сковородку крышкой, а огонь убавьте. Существует немало разновидностей фриттаты. В Неаполе в нее добавляют даже макароны.
0|https://eda.ru/recepty/supy/tomatnij-magribskij-sup-15584|Томатный магрибский суп|Ресторан и еда|Томатный магрибский суп особенно распространен в Марокко и Тунисе. Он весьма прост в приготовлении и сам по себе легкий — в основе томаты и куриный бульон. Кроме них в супе только необходимые специи, мед и лимон, которые все вместе и передают тот самый восточный колорит. Вкус супа всецело зависит от качества томатов. Нужно брать очень спелые, иначе они не разварятся до нужного состояния. Дополнят блюдо свежая кинза и отдельные дольки лимона. Если суп покажется слишком экзотичным и легким, никто не мешает добавить фасоль или куриное мясо.
0|https://eda.ru/recepty/vypechka-deserty/morkovnie-keksi-s-imbirem-koricej-19945|Морковные кексы с имбирем и корицей|Ресторан и еда|Отличный пример того, как из продуктов, которые есть дома практически всегда, можно сделать оригинальную выпечку — морковные кексы с имбирем и корицей. Вообще кексы — всегда удобная форма для экспериментов. Их можно делать сладкими или солеными, выпекать в большой форме или в маленьких порционных. При этом нет строгих правил сочетаний — что вам нравится, то и идет в ход. Здесь сладковатая морковь подчеркивается пряным вкусом имбиря и корицей. При этом можно еще добавить немного дробленных орехов — как для сытости, так и для интереса.
0|https://eda.ru/recepty/vypechka-deserty/maffiny-s-golubikoy-21506|Маффины с голубикой и мускатным орехом|Ресторан и еда|Культовая ягода, которую научились производить круглый год, в сочетании с рыхлым тестом — это абсолютно беспроигрышный вариант. Маффины с голубикой (да и не только с этой ягодой) стали популярным десертом в Англии и Америке, хотя происхождение их французское. Да и вообще эти маленькие сладкие кексы, какими мы их знаем сейчас, задумывались как обычный хлеб и на вкус были нейтральны. Сегодня существуют сотни рецептов этой выпечки: дрожжевые или с разрыхлителем, с использованием молока или сметаны, сладкие или соленые, с жидким центром или без. Этот ароматный хлеб хорош во всех своих проявлениях.
0|https://eda.ru/recepty/salaty/nut-s-baklazhanom-22649|Нут с баклажаном|Ресторан и еда|Есть продукты, к которым относятся религиозно. Хотя сами продукты к религии прямого отношения не имеют. Украинское сало, итальянские помидоры, луховицкие огурцы — таких примеров тысячи. Турецкий горох нут — один из них. Однако самое известное с ним блюдо, — хумус — не самый лучший показатель вкусовых качеств этого гороха. Из него также интересно делать супы и закуски, где он будет присутствовать в цельном виде. А самый главный его плюс состоит в том, что спустя некоторое время приготовленный нут становится еще вкуснее.
0|https://eda.ru/recepty/pasta-picca/spagetti-s-chesnokom-maslom-17620|Спагетти с чесноком и маслом|Ресторан и еда|В средневековой Италии практиковали своего рода раздельное питание: феодалы ели мясо, а крестьянам приходилось изобретать блюда из того, что было под рукой. Паста алио-олио (спагетти с чесноком и маслом) — наследие того времени. Замечательна она тем, что из минимума компонентов получается ароматное и насыщенное вкусами блюдо, а приготовить его совсем не сложно.
