num|url|title|category|data
0|https://fitaudit.ru/food/abc|Протеин сывороточный|Ресторан и еда|Сывороточный протеин — это высококачественный белковый продукт, получаемый из молочной сыворотки при производстве сыра. Он легко усваивается, богат незаменимыми аминокислотами и часто используется в спортивном питании для ускорения восстановления мышц. В ресторанах сывороточный протеин можно найти в коктейлях, десертах и здоровых блюдах.
0|https://fitaudit.ru/food/abc|Протеиновые добавки на основе молока|Ресторан и еда|Протеиновые добавки на основе молока — это спортивные пищевые продукты, содержащие высококачественный белок, извлеченный из молока, как казеин или сыворотка. Они используются для поддержки роста мышечной массы, восстановления после тренировок и общего улучшения рациона. В ресторанах могут применяться в белковых коктейлях, десертах или различных блюдах для увеличения питательной ценности меню.
0|https://fitaudit.ru/food/abc|Пшеница пророщенная|Ресторан и еда|Пшеница пророщенная — это зерно пшеницы, которое прошло процесс проращивания, в результате чего увеличивается его питательная ценность. Она богата витаминами, минералами и ферментами, улучшает пищеварение. Используется в салатах, смузи и как гарнир, добавляя текстуру и аромат. Пророщенная пшеница популярна в здоровом питании и кулинарии.
0|https://fitaudit.ru/food/abc|Пшено|Ресторан и еда|Пшено — это крупа, получаемая из проса, богатая витаминами и минералами. В ресторанной сфере его используют в различных блюдах, включая гарниры, каши и запеканки. Пшено ценится за свою питательность, легкость приготовления и разнообразие текстур, что делает его популярным ингредиентом как в традиционной, так и в современной кухне.
0|https://fitaudit.ru/food/abc|Радиккьо|Ресторан и еда|Радиккьо — горьковатый листовой овощ из семейства астровых, часто используемый в средиземноморской кухне. Имеет характерный красно‑фиолетовый цвет, хрустящую структуру и слегка острый привкус. Его подают в салатах, гарнирах, запеканках и как ингредиент пиццы, придавая блюдам яркий цвет и ароматную горчинку. (55 слов)
0|https://fitaudit.ru/food/abc|Раки|Ресторан и еда|Раки — это пресноводные или морские беспозвоночные, относящиеся к классу ракообразных. В кулинарии их используют как деликатес, часто подают вареными или жареными. Раки богаты белком и низкокалорийны. Популярны в ресторанах морепродуктов, часто сопровождаются соусами и гарнирами, такими как картофель или овощи.
0|https://fitaudit.ru/food/abc|Рамбутан|Ресторан и еда|Рамбутан - тропический фрукт с яркой, пушистой кожурой, родом из Юго-восточной Азии. Мясистая мякоть обладает сладким вкусом и напоминает по текстуре личи. Рамбутан богат витамином C, антиоксидантами и клетчаткой. В ресторанной культуре используется в десертах, коктейлях и салатах, придавая блюдам экзотический аромат и привлекательный внешний вид.
0|https://fitaudit.ru/food/abc|Рёбрышки (рёбра) свиные|Ресторан и еда|Рёбрышки свиные — это мясные куски, вырезанные из ребер свиней. Они отличаются сочным и нежным мясом с характерным вкусом, подходят для различных способов приготовления: запекания, гриля или тушения. Популярны в BBQ и гастрономии многих стран, часто подаются с соусами и гарнирами. Идеальны для создания атмосферных блюд в ресторанах.
0|https://fitaudit.ru/food/abc|Ревень|Ресторан и еда|Ревень — это многолетнее травянистое растение с крепким корневищем и крупными листьями. Его стебли, имеющие ярко-розовый или зеленый цвет, используются в кулинарии для приготовления десертов, компотов и варений. В ресторанах ревень часто добавляют в выпечку и салаты, ценится за свою кислинку и яркий вкус.
0|https://fitaudit.ru/food/abc|Редиска|Ресторан и еда|Редиска — сеть кафе‑ресторанов, специализирующаяся на современной русской кухне с акцентом на свежие овощи, в частности редис. В меню — лёгкие салаты, закуски и горячие блюда, дополненные авторскими соусами. Интерьер оформлен в светлых тонах, поддерживая атмосферу уюта и здорового питания. (58 слов)
0|https://fitaudit.ru/food/abc|Репа|Ресторан и еда|Репа — корнеплод с характерным сладковатым вкусом, богатый витаминами и минералами. В кулинарии используется в разнообразных блюдах: супах, салатах и запеканках. Она популярна в разных кухнях мира благодаря своей питательной ценности и универсальности. Часто подается как гарнир или используется в вегетарианских рецептах.
0|https://fitaudit.ru/food/abc|Ржаное зерно (рожь)|Ресторан и еда|Ржаное зерно (рожь) — это злак, используемый в производстве муки, хлеба и других продуктов питания. Оно богато клетчаткой, витаминами и минералами. В кулинарии рожь часто применяется для выпечки ржаного хлеба, который отличается насыщенным вкусом и ароматом. Ржаная мука также используется в пастах и десертах, добавляя уникальные текстуры и вкусы.
0|https://fitaudit.ru/food/abc|Рис|Ресторан и еда|Рис — злаковая культура, широко используемая в кулинарии. Он является основным гарниром и основным ингредиентом для множества блюд, включая суши, паэлью и ризотто. Рис богат углеводами и витаминами, что делает его популярным выбором в ресторанах разных кухонь мира. Разнообразие сортов риса позволяет экспериментировать с текстурой и вкусом блюд.
0|https://fitaudit.ru/food/abc|Розмарин|Ресторан и еда|Розмарин – ароматная многолетняя травянистая растение семейства яснотковых, широко используемое в кулинарии. Ценится за свой яркий вкус и аромат. Часто применяется в блюдах из мяса, рыбных и овощных рецептах, а также в соусах. Также обладает лечебными свойствами, используется в косметологии и как натуральный консервант.
0|https://fitaudit.ru/food/abc|Ром|Ресторан и еда|Ром — это крепкий алкогольный напиток, производимый из сахарного тростника или мелассы. Он отличается сладким вкусом и ароматом, часто используется в коктейлях и как дижестив. В ресторанах ром может быть представлен в виде отдельных напитков, кулинарных блюд или десертов, добавляя уникальность и разнообразие в меню.
0|https://fitaudit.ru/food/abc|Руккола|Ресторан и еда|Руккола — это зелёный листовой овощ с насыщенным, немного ореховым вкусом. Используется в салатах, пастах и как гарнир. Популярна в итальянской кухне, высоко ценится за богатство витаминов (A, C, K) и антиоксидантов. Часто подают свежей или слегка обжаренной. Подходит для вегетарианских и веганских блюд.
0|https://fitaudit.ru/food/abc|Рыба-меч|Ресторан и еда|Рыба-меч (Xiphias gladius) – крупная хищная рыба, известная своим длинным, мечевидным клювом. Она обитает в теплых морских водах и ценится за нежное мясо, используемое в кулинарии. Рыба-меч популярна в ресторанах, особенно для гриля и запекания, предлагая богатый вкус и высокое содержание белка.
0|https://fitaudit.ru/food/abc|Ряженка|Ресторан и еда|Ряженка — тоже́плое ферментированное молоко, получаемое при медленном выпаривании сливок или цельного молока и последующей закваске специальными молочнокислыми бактериями. Имеет кремово‑мягкую текстуру, сладковатый аромат карамели и лёгкую кислинку. Часто подаётся в кафе и ресторанах как напиток к завтраку, десерт или ингредиент блюд.
0|https://fitaudit.ru/food/abc|Сакэ|Ресторан и еда|Сакэ — японский алкогольный напиток, получаемый путем брожения риса. Он варьируется по вкусу и аромату, в зависимости от сорта риса и технологии производства. Сакэ может подаваться горячим или холодным, сочетаясь с различными блюдами японской кухни. Это традиционный элемент японской культуры и гастрономии.
0|https://fitaudit.ru/food/abc|Салат айсберг|Ресторан и еда|Салат айсберг — это хрустящий сорт салата с компактными, плотными кочанами. Он обладает нежным вкусом и освежающей текстурой, что делает его популярным ингредиентом в салатах, сэндвичах и буррито. Отлично удерживает соусы, идеален для подачи в ресторанах и кафе. Высокое содержание воды способствует его питательной ценности и привлекательности для клиентов.
0|https://fitaudit.ru/food/abc|Сало свиное (без прослойки)|Ресторан и еда|Сало свиное (без прослойки) — это традиционный продукт, представляющий собой соленый или копченый свиной жир без мяса. Используется в кулинарии как закуска, для приготовления бутербродов и в качестве ингредиента для различных блюд. Обладает ярким вкусом и является популярным в славянской кухне. Часто подается с хлебом, чесноком или луком.
0|https://fitaudit.ru/food/abc|Салями|Ресторан и еда|Салями — это вид подсушенной колбасы, популярный в кухнях разных стран. Изготавливается из свинины, говядины или других видов мяса с добавлением специй, соли и, иногда, вина. Салями обычно нарезают тонкими ломтиками и подают как закуску, ингредиент для бутербродов или часть мясных platters в ресторанах.
0|https://fitaudit.ru/food/abc|Саподилла|Ресторан и еда|Саподилла — это тропический фрукт, родом из Центральной Америки, с сладкой, а на вкус напоминающей карамель мякотью. Он богат витаминами и антиоксидантами. В кулинарии используется в свежем виде, для приготовления десертов, смузи и фруктовых салатов. Подается в ресторанах, специализирующихся на экзотических десертах и тропической кухне.
0|https://fitaudit.ru/food/abc|Сардина|Ресторан и еда|Сардина — это мелкая рыба из семейства сельдевых, часто используемая в кулинарии. Она имеет нежное мясо и богатый вкус, идеально подходит для консервирования, жарки или запекания. Сардины являются источником омега-3 жирных кислот и витаминов, что делает их популярным выбором в ресторанных меню и здоровом питании.
0|https://fitaudit.ru/food/abc|Сахар|Ресторан и еда|Сахар — сладкий кристаллический подсластитель, получаемый из свеклы, тростника или фруктов. В ресторанах используется в десертах, напитках, соусах и маринадах, придавая блюдам ароматную сладость и улучшая структуру. Содержание сахара влияет на вкусовой баланс, калорийность и пищевые свойства готовых блюд. (55 слов)
0|https://fitaudit.ru/food/abc|Сахарин|Ресторан и еда|Сахарин — искусственный подсластитель, который в 300-400 раз слаще сахара, низкокалорийный и часто используется в диетических продуктах и напитках. Он способствует снижению калорийности блюд, что делает его популярным в ресторанах, предлагающих низкоуглеводные или безсахарные варианты для клиентов, следящих за своим питанием.
0|https://fitaudit.ru/food/abc|Сахарное яблоко|Ресторан и еда|"Сахарное яблоко, также известное как ""анон"" или ""кукуруза"", — это тропический фрукт с мягкой сладкой мякотью и тонкой кожурой. Он имеет форму груши и может быть зеленоватым или желтым. Вкус напоминает смесь банана и манго, что делает его популярным в десертах и напитках. Содержит витамины и антиоксиданты."
0|https://fitaudit.ru/food/abc|Свекла|Ресторан и еда|Свекла — корнеплод с ярким красным цветом, богатый витаминами и минералами. Используется в кулинарии для приготовления салатов, гарниров и супов. Обладает сладковатым вкусом и характерной текстурой. Популярна в вегетарианских и здоровых блюдах, а также как натуральный краситель. Часто подается в ресторанах с добавлением орехов, сыра или цитрусовых.
0|https://fitaudit.ru/food/abc|Свиная печень|Ресторан и еда|Свиная печень — это мясной продукт, получаемый из свиней. Она богата витаминами (особенно группы B), mineralами и железом, что делает её питательным источником. Используется в кулинарии для приготовления паштетов, жаркого и других блюд. Популярна во многих кухнях мира благодаря своему насыщенному вкусу и текстуре.
0|https://fitaudit.ru/food/abc|Свинина|Ресторан и еда|Свинина — мясо свиней, популярное в кулинарии благодаря своим разнообразным вкусам и текстурам. Она используется в различных блюдах, от стейков до колбас и жаркого. Свинина обладает высоким уровнем жира, что придает блюдам сочность и насыщенность. В разных культурах существуют свои традиции приготовления свинины, что делает ее универсальным ингредиентом в ресторанах.
0|https://fitaudit.ru/food/abc|Свинина, запечённая в духовке|Ресторан и еда|Свинина, запечённая в духовке — популярное блюдо, готовящееся из кусочков свинины, приправленных специями и соусами. Она запекается в духовке до золотистой корочки, сохраняя сочность и аромат. Это блюдо часто подают с гарнирами, такими как картофель или овощи, и подходит для праздничных ужинов и семейных встреч.
0|https://fitaudit.ru/food/abc|Свиное лёгкое|Ресторан и еда|Свиное лёгкое — это орган, извлекаемый из свиньи, которое используется в кулинарии. Оно обладает мягкой текстурой и нейтральным вкусом, что делает его универсальным ингредиентом. В ресторанах может быть приготовлено различными способами: жарка, запекание, тушение. Популярно в некоторых кухнях мира, особенно в традиционных блюдах.
0|https://fitaudit.ru/food/abc|Свиной желудок|Ресторан и еда|Свиной желудок — это орган животного, чаще всего используемый в кулинарии, особенно в блюдах народов Европы и Азии. Обладает плотной структурой и характерным вкусом. Популярен в традиционных рецептах, таких как тушеные блюда и фаршированные желудки. Часто подается с соусами или в сочетании с овощами и специями.
0|https://fitaudit.ru/food/abc|Свиные кишки|Ресторан и еда|Свиные кишки — это часть пищеварительной системы свиньи, используемая в кулинарии для приготовления различных блюд, таких как колбасы и сосиски. Они популярны в разных кухнях мира за счет своей текстуры и способности удерживать аромат при приготовлении. Часто используются в ресторанах, специализирующихся на мясных деликатесах.
0|https://fitaudit.ru/food/abc|Сельдерей|Ресторан и еда|Сельдерей — это овощное растение из семейства петрушковых, характеризующееся хрустящими стеблями и ярким вкусом. Используется в салатах, супах, соках и как гарнир. Сельдерей богат витаминами, минералами и антиоксидантами, что делает его популярным выбором в здоровом питании и кулинарии.
0|https://fitaudit.ru/food/abc|Сельдь|Ресторан и еда|Сельдь — это морская рыба семейства сельдевых, популярная в кулинарии благодаря своему богатому вкусу и текстуре. Используется как в свежем, так и в соленом виде, часто подается в салатах, закусках или как самостоятельное блюдо. Сельдь богата омега-3 жирными кислотами, витаминами и минералами.
0|https://fitaudit.ru/food/abc|Сёмга|Ресторан и еда|Сёмга — морская рыба семейства лососевых, известная нежным розовым мяском, высоким содержанием омега‑3 и ярким вкусовым характером. Часто подаётся в ресторанах в виде стейков, филе, копчения или сашими, используется в соусах, салатах и блюдах из рыбы. (≈45 слов)
0|https://fitaudit.ru/food/abc|Семена аниса|Ресторан и еда|Семена аниса — это ароматичные семена растения анис, популярные в кулинарии. Они обладают сладковатым, пряным вкусом и часто используются для ароматизации выпечки, алкогольных напитков и блюд. Семена аниса также ценятся за их полезные свойства, включая улучшение пищеварения и антиоксидантные эффекты.
