num,url,title,category,data
0|https://eda.ru/recepty/osnovnye-blyuda/treska-s-pomidorami-17591|Треска с помидорами|Ресторан и еда|Треска — крупная морская рыба с сочным белым мясом. В русской кухне треска очень ценится и служит основой множеству традиционных блюд. В магазинах легко достать замороженное филе и экспериментировать с ним в любых вариациях. В Мурманске даже возвели памятник треске, который красуется на главной площади города. Это к тому же очень диетичная рыба, богатая белком. И готовится она очень просто. Треска с помидорами запекается в духовке всего за пятнадцать минут — достаточно поместить все ингредиенты в кулинарный рукав и встряхнуть.
0|https://eda.ru/recepty/vypechka-deserty/kish-loren-so-shpinatom-20251|Киш лорен со шпинатом|Ресторан и еда|Гастрономический топоним французской кухни (что крайняя редкость) — лотарингский открытый пирог с формой из слоеного теста, куда кладутся слегка обжаренная ветчина и лук и заливается яично-сырная смесь. В нашем варианте представлена более современная версия французского киша, так как традиционный рецепт сложно опознать — уж очень давно он появился и получил массу добавлений. Киш лорен со шпинатом не исключает наличия мяса в виде грудинки и овощей в виде моркови, чего, впрочем, вкупе с яйцами и достаточно, для того чтобы считаться известным французским пирогом.
0|https://eda.ru/recepty/rizotto/rizotto-so-slivkami-sladkim-percem-15911|Ризотто со сливками и сладким перцем|Ресторан и еда|Если верить легенде о забывчивом поваре из Италии, прадед ризотто — простой рисовый суп, который случайно оставили на плите. Свой насыщенный вкус ризотто приобретает благодаря наваристому бульону. Рекомендуется использовать овощной бульон, но никто вам не помешает заменить его на куриный, грибной или даже рыбный. Рис должен полностью впитать его в себя и при этом не потерять структуры, поэтому в процессе готовки бульон доливается и аккуратно вмешивается по одному половнику. Ризотто со сливками и сладким перцем и слегка уловимым ароматом хереса сочетает в себе сразу несколько вкусов, но при этом они очень гармоничны между собой. Лучше использовать рис арборио — он остается внутри слегка твердым.
0|https://eda.ru/recepty/rizotto/rizotto-so-slivkami-sladkim-percem-15911|Ризотто со сливками и сладким перцем|Ресторан и еда|Если верить легенде о забывчивом поваре из Италии, прадед ризотто — простой рисовый суп, который случайно оставили на плите. Свой насыщенный вкус ризотто приобретает благодаря наваристому бульону. Рекомендуется использовать овощной бульон, но никто вам не помешает заменить его на куриный, грибной или даже рыбный. Рис должен полностью впитать его в себя и при этом не потерять структуры, поэтому в процессе готовки бульон доливается и аккуратно вмешивается по одному половнику. Ризотто со сливками и сладким перцем и слегка уловимым ароматом хереса сочетает в себе сразу несколько вкусов, но при этом они очень гармоничны между собой. Лучше использовать рис арборио — он остается внутри слегка твердым.
0|https://eda.ru/recepty/osnovnye-blyuda/tushenaya-kapusta-17323|Тушеная капуста|Ресторан и еда|Тушеная белокочанная капуста хороша сама по себе. Но если снабдить ее всеми прописанными в рецепте ингредиентами, да еще придать ей крепости с помощью пшеничной муки, получится и отличный яркий гарнир к красному мясу, и самодостаточная закуска, горячая или холодная.
0|https://eda.ru/recepty/zakuski/adzharskie-hachapuri-31243|Аджарские хачапури|Ресторан и еда|Аджарское хачапури — выпечка в форме лодочки и классическое блюдо грузинской кухни. Считается, что хачапури придумали в горах на северо-западе страны: там жили пастухи, у которых не было возможности обстоятельно пообедать. По другой легенде, аджарскоехачапури приготовили в форме лодки, так как у Аджарии есть выход к морю. Как бы то ни было, аджарское хачапури— это красиво: тесто у него румяное и выгодно сочетается с сияющим желтком. Чтобы приготовить вкусные аджарские хачапури, понадобятся простые ингредиенты: яйца, мука, сыр, молоко, масло, дрожжи — в общем, все то, что почти всегда есть дома под рукой. Сначала нужно замесить упругое тесто, а пока оно отдыхает, натереть сыр для начинки. Потом из теста формируются те самые лодочки, в углубление которых отправляется сыр, и дальше вся эта красота запекается в духовке. Перед подачей в горячее хачапури кладут желток и пару кусочков масла.
0|https://eda.ru/recepty/vypechka-deserty/shokoladnij-kapkejk-s-kremom-ganash-21503|Шоколадный капкейк с кремом ганаш|Ресторан и еда|Кофе подчеркивает вкус горького шоколада, придает капкейку аппетитный и насыщенный цвет. А золото — можно попробовать раздобыть кондитерское сусальное — делает эти капкейки особенно нарядными и торжественными. Состав традиционного французского ганаша не меняется уже несколько веков. Это всегда качественный черный шоколад, жирные сливки и хорошее сливочное масло. Главное в соусе — однородность, поэтому он тщательно промешивается. Чем гуще застынет ганаш, тем лучше шапочки капкейков будут держать форму. А густоты можно добиться, увеличив пропорции шоколада.
0|https://eda.ru/recepty/supy/gribnoy-sup-18620|Грибной суп|Ресторан и еда|Грибной суп — один из самых популярных в России. Для этого рецепта можно взять любые свежие грибы нашей полосы — от крепких и тугих подберезовиков до нарядных лисичек. Сушеные грибы тоже подойдут, они отдадут супу характер и душистость, а вот свежие — плоть и живость. Грибы любят сливочность, поэтому добрая ложка или две жирной сметаны только украсит этот замечательный суп. И не забудьте про зелень: чем ее больше, тем лучше. Чтобы приготовить грибной суп, смотрите наш рецепт.
0|https://eda.ru/recepty/osnovnye-blyuda/govjadina-po-burgundski-19282|Говядина по-бургундски|Ресторан и еда|Bœuf bourguignon (беф-бургиньон), говядина по-бургундски — классика французской кухни, традиционный способ сделать жесткое мясо прекрасным с помощью красного вина. В данном случае предпочтительно, чтобы вино было бургундским. Во вкусовом ансамбле также участвуют лук, морковь, чеснок, иногда грибы. Готовится блюдо долго — не менее трех часов, — но в течение этого времени почти не требует к себе внимания. Новый интерес к этому рецепту вспыхнул после выхода фильма «Джули и Джулия» — Джулия Чайлд называла его едва ли не главным рецептом французской кухни вообще. Мы добавили в это блюдо еще и бекон — для разнообразия.
0|https://eda.ru/recepty/osnovnye-blyuda/tushenaya-svinina-16691|Тушеная свинина|Ресторан и еда|Готовить тушеную свинину совсем несложно — главное, найти вкусное мясо, которое благодатно впитает в себя все соки. В этом рецепте не указано, какая именно часть свинины идет в дело, и это понятно: мясу предстоит долго томиться с луком и соусом, поэтому можно использовать самые сухие части, вплоть до вырезки. Указанная среди ингредиентов ржаная мука придаст блюду интересную текстуру — так подливка будет гуще и сытнее — и яркий терпкий аромат ржаной горбушки. Можно использовать и пшеничную муку, но тогда не добиться такого благоухания.
0|https://eda.ru/recepty/salaty/koulslo-19416|Салат Коулсло|Ресторан и еда|«Коулсло», а по-русски — капустный салат с майонезом. Классика американской кухни и одна из самых популярных в мире быстрых хрустящих закусок. Один из тех салатов, который можно попробовать в любой части света и приготовить за десять минут. Традиционный рецепт коулсло требует двух видов капусты, редьки, морковки и майонеза. Такой салат хорошо подавать в качестве самостоятельной закуски, но лучше всего подобрать ему в пару что-то жареное: стейк, крылья или шашлык.
0|https://eda.ru/recepty/osnovnye-blyuda/tushenaya-govyadina-40151|Тушеная говядина|Ресторан и еда|Честная зимняя еда, которая может облагородить любой кусок не слишком нежной духовой говядины. Самые упорные части говяжьей туши на выходе получаются как раз самыми вкусными: в результате длительной термической нагрузки волокна размягчаются, но не теряют мясной насыщенности, а из-за обилия коллагеновых жилок восхитительно густеет соус. Кроме времени, этот рецепт тушеной говядины не требует практически ничего — только зажарку из моркови и лука, которая карамелизирует мясные кусочки, и разного вида перец — душистый, паприку и обычный черный — для аккуратной остроты.
0|https://eda.ru/recepty/supy/kuksi-15590|Корейский суп кукси|Ресторан и еда|Словом «куксу», или «кукси», как говорят корейцы из России, в корейском языке обозначают любую лапшу и блюда с ней. Большинство рецептов кукси — это лапша с бульоном и всевозможными добавками: от груши, говядины и перца до омлета, папоротника, дайкона и ферментированной соевой пасты. Чаще всего кукси едят в холодном виде, но его можно запросто превратить и в зимний согревающий суп: классические рецепты вполне допускают такие вольности. Конкретно в этом рецепте кукси — пшеничная лапша и холодная заправка. А для дополнительных ощущений овощи можно залить предварительно раскаленным растительным маслом. Главный нюанс и фишка кукси — в хорошем соотношении кислого и острого, так что обычно к холодному супу подают соевый соус и уксус.
0|https://eda.ru/recepty/zakuski/megrelskie-hachapuri-31244|Мегрельские хачапури|Ресторан и еда|Хачапури — один из столпов грузинской кухни. Вариантов существует множество. Хачапури по-мегрельски, наверное, требует наименьших усилий: понадобится большое количество сыра, духовка и около полутора часов свободного времени. Классическое тесто для мегрельских хачапури готовится на мацони, в этом случае тесто поднимается благодаря кисломолочным микроорганизмам. Впрочем, этот редкий в России продукт можно заменить на смесь молока, сметаны и сухих дрожжей.
0|https://eda.ru/recepty/zakuski/babaganush-s-kunzhutom-32522|Бабагануш с кунжутом|Ресторан и еда|Классическая ближневосточная ­закуска, которую можно есть самостоятельно, с хлебом, а также в качестве холодного или горячего гарнира. Лучше всего подходит к блюдам с сыром и бараниной.
0|https://eda.ru/recepty/osnovnye-blyuda/lapsha-s-tikvoj-gribami-18595|Лапша с тыквой и грибами|Ресторан и еда|Лапша с тыквой и грибами — простое и вкусное осеннее блюдо, где сладость тыквы встречается с задумчивым, почти мясным вкусом грибов, а грибное естество удачно дополняется нарядным рыжим цветом. Варьируя количество жидкости — это блюдо можно довести как до состояния густой похлебки с лапшой, так и до пасты с выразительным и нарядным по цвету соусом. Если вы хотите, чтобы тыква присутствовала в вашей пасте в виде кубиков, к примеру, а не в пюреобразном состоянии, обжарьте ее слегка и добавьте в соус ненадолго, в последний момент.
0|https://eda.ru/recepty/osnovnye-blyuda/pajelja-s-krevetkami-kuricej-17276|Паэлья с креветками и курицей|Ресторан и еда|Паэлья — блюдо средиземноморской кухни, испанский плов, в основе которого всегда круглый белый рис, заправленный шафраном. В ней часто одновременно сочетается куриное мясо, морепродукты и разнообразные овощи. Свое название блюдо получило от специальной глубокой сковороды с толстыми стенками. В ней ингредиенты не просто обжариваются, а готовятся в собственном соку. Однако в домашних условиях, на обычной сковороде, паэлья получается не менее вкусной и ароматной. А если готовить ее на оливковом масле с добавлением различных специй и белого сухого вина, она приобретет по-настоящему испанский вкус. В этом рецепте золотистая паэлья готовится на курином бульоне с креветками, куриными бедрами, болгарским перцем, горошком и другими овощами. Подавать блюдо рекомендуется с холодным розовым каталонским или валенсийским вином.
0|https://eda.ru/recepty/pasta-picca/picca-margarita-valtera-bizoffi-35393|Пицца «Маргарита» Вальтера Бизоффи|Ресторан и еда|Вальтер Бизоффи, шеф-повар петербургского ресторана Goose Goose, представил свой рецепт знаменитой пиццы «Маргарита», которую впервые приготовили в Неаполе в конце 19 века. «Маргарита» получила свое название в честь жены итальянского короля Умберто I. По мнению Бизоффи, деревенская кухня — основа современной итальянской кулинарии. В ее блюдах заключены любовь и забота, которые итальянские хозяйки на протяжении многих лет вкладывают в рецепты из простых и недорогих продуктов. По рецепту Бизоффи пышную пиццу можно приготовить даже без скалки. Главное выбрать хорошие ингредиенты: помидоры пелати, мука semola — из твердых сортов пшеницы, и плотная, влажная моцарелла, чтобы сыр, как в кино, растекся по всей поверхности пиццы.
0|https://eda.ru/recepty/salaty/koulslo-19416|Салат Коулсло|Ресторан и еда|«Коулсло», а по-русски — капустный салат с майонезом. Классика американской кухни и одна из самых популярных в мире быстрых хрустящих закусок. Один из тех салатов, который можно попробовать в любой части света и приготовить за десять минут. Традиционный рецепт коулсло требует двух видов капусты, редьки, морковки и майонеза. Такой салат хорошо подавать в качестве самостоятельной закуски, но лучше всего подобрать ему в пару что-то жареное: стейк, крылья или шашлык.
0|https://eda.ru/recepty/vypechka-deserty/shvedskie-bulochki-s-koricey-80444|Шведские булочки с корицей|Ресторан и еда|Национальное достояние Швеции, символ и квинтэссенция шведского образа жизни. Есть даже особенный день, посвященный булочке с корицей, а именно 4 октября: Kanelbullens dag. Каждый год только в этот день продается 7 000 000 булочек — а страну населяют 10 миллионов человек. Кстати, плюшки, которые уплетал в русском переводе придуманный Астрид Линдгрен Карлсон, — это те самые булочки с корицей.
0|https://eda.ru/recepty/osnovnye-blyuda/befstroganov-33435|Бефстроганов|Ресторан и еда|Базовый элемент отечественной гастрономической мифологии, важнейший ее экспортный товар. Пожалуй, единственное действительно признанное всем миром блюдо русской кухни («русский салат» близко не имеет подобной славы, более того, в большинстве иностранных вариантов сильно не похож на своего прародителя — оливье). «Беф Строганофф» можно найти в меню десятков тысяч ресторанов по всему свету, причем в девяносто девяти процентах случаев это не будут рестораны русской кухни. Это блюдо из фонда, принадлежащего всему человечеству. Для хорошего бефстроганова используются мягкие куски вырезки или другие благородные части, и они обжариваются отдельно от соуса и только прогреваются в нем.
0|https://eda.ru/recepty/zakuski/lenivie-vareniki-39437|Ленивые вареники|Ресторан и еда|Ленивые вареники со сладкой начинкой хороши на завтрак, но можно сделать с картошкой, сварить их в мясном бульоне и подать на ужин. Быстрее всего ленивые вареники выходят с творогом. Главное отличие вареников от пельменей — в форме и в начинке: вареники редко делают с мясом, тесто защипывается по-другому, а еще пельмени не бывают ленивыми. Пельмени проигрывают вареникам по количеству памятников — у последних их несколько в разных местах: есть в русских Черкассах, в селе Синьки и в канадском Торонто.
