num|url|title|category|data
0|site.ru/образование-134|Образование|Образование|Взял курс по изучению китайского
0|site.ru/образование-135|Образование|Образование|Купил книги по экономике для самообразования
0|site.ru/образование-136|Образование|Образование|Оплатил онлайн-интенсив по продажам
0|site.ru/образование-137|Образование|Образование|Взял курс по деревообработке
0|site.ru/образование-138|Образование|Образование|Купил образовательную подписку
0|site.ru/образование-139|Образование|Образование|Оплатил кружок рисования для дочки
0|site.ru/образование-140|Образование|Образование|Взял курс по эффективному чтению
0|site.ru/образование-141|Образование|Образование|Купил набор для изучения Arduino
0|site.ru/образование-142|Образование|Образование|Оплатил языковые курсы в институте
0|site.ru/образование-143|Образование|Образование|Взял обучение по ведению бизнеса
0|site.ru/образование-144|Образование|Образование|Купил тренажёр для языка в приложении
0|site.ru/образование-145|Образование|Образование|Оплатил курсы бухгалтерии
0|site.ru/образование-146|Образование|Образование|Взял мастер-класс по керамике
0|site.ru/образование-147|Образование|Образование|Купил книги по архитектуре для учёбы
0|site.ru/образование-148|Образование|Образование|Оплатил онлайн-лекции по философии
0|site.ru/образование-149|Образование|Образование|Взял курс по спортивному питанию
0|site.ru/развлечения-1|Развлечения|Развлечения|Сходил в кино с подругой, взяли попкорн
0|site.ru/развлечения-2|Развлечения|Развлечения|Купил билеты в кинотеатр на новый фильм
0|site.ru/развлечения-3|Развлечения|Развлечения|Пошли в IMAX смотреть блокбастер
0|site.ru/развлечения-4|Развлечения|Развлечения|Билет в кино на вечерний сеанс
0|site.ru/развлечения-5|Развлечения|Развлечения|Сходили в кино всей семьёй, дорого но весело
0|site.ru/развлечения-6|Развлечения|Развлечения|Взял билет в кино на мультик с ребёнком
0|site.ru/развлечения-7|Развлечения|Развлечения|Сходил на премьеру фильма
0|site.ru/развлечения-8|Развлечения|Развлечения|Кино в 3D, хорошее впечатление
0|site.ru/развлечения-9|Развлечения|Развлечения|Взял билеты на ночной сеанс
0|site.ru/развлечения-10|Развлечения|Развлечения|Сходили в кинотеатр, смотрели хоррор
0|site.ru/развлечения-11|Развлечения|Развлечения|Купил билеты в театр на спектакль
0|site.ru/развлечения-12|Развлечения|Развлечения|Сходил на концерт любимой группы
0|site.ru/развлечения-13|Развлечения|Развлечения|Взял билеты на стендап-шоу
0|site.ru/развлечения-14|Развлечения|Развлечения|Поехали на концерт в соседний город
0|site.ru/развлечения-15|Развлечения|Развлечения|Купил билет на балет, давно мечтал
0|site.ru/развлечения-16|Развлечения|Развлечения|Сходили на спектакль с женой
0|site.ru/развлечения-17|Развлечения|Развлечения|Взял билеты на рок-концерт
0|site.ru/развлечения-18|Развлечения|Развлечения|Сходил на стендап, было очень смешно
0|site.ru/развлечения-19|Развлечения|Развлечения|Купил билеты на цирк для детей
0|site.ru/развлечения-20|Развлечения|Развлечения|Сходили на оперу, первый раз
0|site.ru/развлечения-21|Развлечения|Развлечения|Взял билеты на джазовый фестиваль
0|site.ru/развлечения-22|Развлечения|Развлечения|Концерт местной группы, недорого и весело
0|site.ru/развлечения-23|Развлечения|Развлечения|Сходил на открытый фестиваль музыки
0|site.ru/развлечения-24|Развлечения|Развлечения|Купил билеты на шоу фокусника
0|site.ru/развлечения-25|Развлечения|Развлечения|Взял билеты на мюзикл
0|site.ru/развлечения-26|Развлечения|Развлечения|Оплатил подписку Netflix на месяц
0|site.ru/развлечения-27|Развлечения|Развлечения|Взял YouTube Premium, надоела реклама
0|site.ru/развлечения-28|Развлечения|Развлечения|Подписка Spotify, слушаю музыку без рекламы
0|site.ru/развлечения-29|Развлечения|Развлечения|Оплатил Кинопоиск HD, сериалы смотреть
0|site.ru/развлечения-30|Развлечения|Развлечения|Подписка Apple Music
0|site.ru/развлечения-31|Развлечения|Развлечения|Взял OKKO на три месяца
0|site.ru/развлечения-32|Развлечения|Развлечения|Оплатил Premier видеосервис
0|site.ru/развлечения-33|Развлечения|Развлечения|Подписка VK Видео, смотрю сериалы
0|site.ru/развлечения-34|Развлечения|Развлечения|Взял подписку на Иви
0|site.ru/развлечения-35|Развлечения|Развлечения|Оплатил Яндекс Плюс ради музыки и кино
0|site.ru/развлечения-36|Развлечения|Развлечения|Подписка на стриминг, смотрю аниме
0|site.ru/развлечения-37|Развлечения|Развлечения|Взял годовую подписку Spotify со скидкой
0|site.ru/развлечения-38|Развлечения|Развлечения|Оплатил видео-сервис для детей
0|site.ru/развлечения-39|Развлечения|Развлечения|Подписка на Disney Plus
0|site.ru/развлечения-40|Развлечения|Развлечения|Взял подписку на подкасты
0|site.ru/развлечения-41|Развлечения|Развлечения|Купил игру в Steam на распродаже
0|site.ru/развлечения-42|Развлечения|Развлечения|Взял новую игру на PlayStation
0|site.ru/развлечения-43|Развлечения|Развлечения|Купил донат в любимой игре
0|site.ru/развлечения-44|Развлечения|Развлечения|Подписка PS Plus на три месяца
0|site.ru/развлечения-45|Развлечения|Развлечения|Купил игру в App Store
0|site.ru/развлечения-46|Развлечения|Развлечения|Взял DLC к любимой игре
0|site.ru/развлечения-47|Развлечения|Развлечения|Донат в мобильной игре, зашёл в ивент
0|site.ru/развлечения-48|Развлечения|Развлечения|Купил Xbox Game Pass на месяц
0|site.ru/развлечения-49|Развлечения|Развлечения|Взял игру в Google Play
0|site.ru/развлечения-50|Развлечения|Развлечения|Купил скин в игре, выглядит круто
0|site.ru/развлечения-51|Развлечения|Развлечения|Подписка Nintendo Online
0|site.ru/развлечения-52|Развлечения|Развлечения|Взял несколько инди-игр на распродаже
0|site.ru/развлечения-53|Развлечения|Развлечения|Купил кейс в CS, повезло
0|site.ru/развлечения-54|Развлечения|Развлечения|Взял пропуск в новом сезоне Fortnite
0|site.ru/развлечения-55|Развлечения|Развлечения|Купил игровой контент онлайн
0|site.ru/развлечения-56|Развлечения|Развлечения|Сходили на боулинг с коллегами
0|site.ru/развлечения-57|Развлечения|Развлечения|Прошли квест-комнату с друзьями
0|site.ru/развлечения-58|Развлечения|Развлечения|Взяли картинг на час, было весело
0|site.ru/развлечения-59|Развлечения|Развлечения|Сходили в аквапарк всей семьёй
0|site.ru/развлечения-60|Развлечения|Развлечения|Зоопарк с детьми, весь день гуляли
0|site.ru/развлечения-61|Развлечения|Развлечения|Взяли батуты для детей в развлекательном центре
0|site.ru/развлечения-62|Развлечения|Развлечения|Сходили на скалодром
0|site.ru/развлечения-63|Развлечения|Развлечения|Пошли в VR-клуб, попробовали виртуальную реальность
0|site.ru/развлечения-64|Развлечения|Развлечения|Взяли лазертаг на группу
0|site.ru/развлечения-65|Развлечения|Развлечения|Сходили на роллердром
0|site.ru/развлечения-66|Развлечения|Развлечения|Аквапарк, купили дневной браслет
0|site.ru/развлечения-67|Развлечения|Развлечения|Пошли на каток, взяли коньки напрокат
0|site.ru/развлечения-68|Развлечения|Развлечения|Сходили в детский развлекательный центр
0|site.ru/развлечения-69|Развлечения|Развлечения|Взяли экскурсию по городу на автобусе
0|site.ru/развлечения-70|Развлечения|Развлечения|Пошли на выставку современного искусства
0|site.ru/развлечения-71|Развлечения|Развлечения|Посетили планетарий с ребёнком
0|site.ru/развлечения-72|Развлечения|Развлечения|Сходили в музей, интересная экспозиция
0|site.ru/развлечения-73|Развлечения|Развлечения|Взяли экскурсию по историческому замку
0|site.ru/развлечения-74|Развлечения|Развлечения|Сходили на фотовыставку
0|site.ru/развлечения-75|Развлечения|Развлечения|Посетили аттракционы в парке
0|site.ru/развлечения-76|Развлечения|Развлечения|Купил настольную игру для вечера с друзьями
0|site.ru/развлечения-77|Развлечения|Развлечения|Взял набор для рисования, новое хобби
0|site.ru/развлечения-78|Развлечения|Развлечения|Купил краски и холст для живописи
0|site.ru/развлечения-79|Развлечения|Развлечения|Взял рыболовные снасти для похода
0|site.ru/развлечения-80|Развлечения|Развлечения|Купил набор для вышивания
0|site.ru/развлечения-81|Развлечения|Развлечения|Взял конструктор LEGO для удовольствия
0|site.ru/развлечения-82|Развлечения|Развлечения|Купил пазл на тысячу деталей
0|site.ru/развлечения-83|Развлечения|Развлечения|Взял набор для плетения из бисера
0|site.ru/развлечения-84|Развлечения|Развлечения|Купил книги по хобби
0|site.ru/развлечения-85|Развлечения|Развлечения|Взял набор для декупажа
0|site.ru/развлечения-86|Развлечения|Развлечения|Сходил в кинчик, кайф
0|site.ru/развлечения-87|Развлечения|Развлечения|Взял нетфликс на месяц, буду смотреть сериалы
0|site.ru/развлечения-88|Развлечения|Развлечения|Задонатил в игрушку, был ивент
0|site.ru/развлечения-89|Развлечения|Развлечения|Купил игрульку в стиме по скидке
0|site.ru/развлечения-90|Развлечения|Развлечения|Сходили в боулинг с пацанами
0|site.ru/развлечения-91|Развлечения|Развлечения|Взяли квест, было круто
0|site.ru/развлечения-92|Развлечения|Развлечения|Прошли виртуальную реальность, зашло
0|site.ru/развлечения-93|Развлечения|Развлечения|Подписка на спотик оформил
0|site.ru/развлечения-94|Развлечения|Развлечения|Кинопоиск взял, сериалы смотреть
0|site.ru/развлечения-95|Развлечения|Развлечения|Купил билеты на концерт любимого исполнителя
0|site.ru/развлечения-96|Развлечения|Развлечения|Сходил на стендап, насмеялся
0|site.ru/развлечения-97|Развлечения|Развлечения|Взял билеты в театрик с женой
0|site.ru/развлечения-98|Развлечения|Развлечения|Оплатил PlayStation Plus, играть с друзьями
0|site.ru/развлечения-99|Развлечения|Развлечения|Сходил в кино в IMAX, стоило того
0|site.ru/развлечения-100|Развлечения|Развлечения|Взял подписку на аниме-сервис
0|site.ru/развлечения-101|Развлечения|Развлечения|Купил новый сезонный пропуск
0|site.ru/развлечения-102|Развлечения|Развлечения|Сходили в аквапарк, дети в восторге
0|site.ru/развлечения-103|Развлечения|Развлечения|Взяли картинг, погоняли
0|site.ru/развлечения-104|Развлечения|Развлечения|Билеты на фестиваль купил заранее
0|site.ru/развлечения-105|Развлечения|Развлечения|Сходил на выставку, понравилось
0|site.ru/развлечения-106|Развлечения|Развлечения|Взял ютуб премиум наконец
0|site.ru/развлечения-107|Развлечения|Развлечения|Купил игру ребёнку на приставке
0|site.ru/развлечения-108|Развлечения|Развлечения|Оплатил мероприятие с детьми
0|site.ru/развлечения-109|Развлечения|Развлечения|Сходили в зоопарк, дети рады
0|site.ru/развлечения-110|Развлечения|Развлечения|Взял аренду квадроциклов на часок
0|site.ru/развлечения-111|Развлечения|Развлечения|Купил билет на комедийное шоу
0|site.ru/развлечения-112|Развлечения|Развлечения|Сходили в ресторан по теме квеста
0|site.ru/развлечения-113|Развлечения|Развлечения|Взяли батуты для детей
0|site.ru/развлечения-114|Развлечения|Развлечения|Купил подписку на стриминг для дома
0|site.ru/развлечения-115|Развлечения|Развлечения|Сходил на лазертаг с коллегами
0|site.ru/развлечения-116|Развлечения|Развлечения|Взял аренду яхты на день
0|site.ru/развлечения-117|Развлечения|Развлечения|Оплатил яхтинг на выходных
0|site.ru/развлечения-118|Развлечения|Развлечения|Купил аттракционы в парке развлечений
0|site.ru/развлечения-119|Развлечения|Развлечения|Взял прокат велосипеда в парке
0|site.ru/развлечения-120|Развлечения|Развлечения|Сходил на мастер-класс по кулинарии
0|site.ru/развлечения-121|Развлечения|Развлечения|Купил эскейп-рум для команды
0|site.ru/развлечения-122|Развлечения|Развлечения|Сходили на конные прогулки
0|site.ru/развлечения-123|Развлечения|Развлечения|Взяли яхту в аренду
0|site.ru/развлечения-124|Развлечения|Развлечения|Купил билет на фестиваль уличной еды
0|site.ru/развлечения-125|Развлечения|Развлечения|Сходили в ночной клуб
0|site.ru/развлечения-126|Развлечения|Развлечения|Взял билеты на дискотеку
0|site.ru/развлечения-127|Развлечения|Развлечения|Купил абонемент на развлечения
0|site.ru/развлечения-128|Развлечения|Развлечения|Сходили на открытый фест с музыкой
0|site.ru/развлечения-129|Развлечения|Развлечения|Взял экскурсию по городу
0|site.ru/развлечения-130|Развлечения|Развлечения|Купил билеты на новый год в ресторане-шоу
0|site.ru/развлечения-131|Развлечения|Развлечения|Сходили на лыжный курорт
0|site.ru/развлечения-132|Развлечения|Развлечения|Взял прокат лыж
0|site.ru/развлечения-133|Развлечения|Развлечения|Купил скипасс на день
0|site.ru/развлечения-134|Развлечения|Развлечения|Сходили на пейнтбол с ребятами
0|site.ru/развлечения-135|Развлечения|Развлечения|Взяли роупджампинг
0|site.ru/развлечения-136|Развлечения|Развлечения|Купил прыжок с парашютом в подарок
0|site.ru/развлечения-137|Развлечения|Развлечения|Сходили на верховую езду
0|site.ru/развлечения-138|Развлечения|Развлечения|Взяли аренду беседки для пикника
0|site.ru/развлечения-139|Развлечения|Развлечения|Купил билет на трамплин
0|site.ru/развлечения-140|Развлечения|Развлечения|Сходили в детский театр
0|site.ru/развлечения-141|Развлечения|Развлечения|Взял книгу художественную для чтения
0|site.ru/развлечения-142|Развлечения|Развлечения|Купил карточную игру для вечера
0|site.ru/здоровье-1|Здоровье|Здоровье|Купил таблетки от головы в аптеке
0|site.ru/здоровье-2|Здоровье|Здоровье|Зашёл в аптеку, взял противовирусное
0|site.ru/здоровье-3|Здоровье|Здоровье|Купил витамины D и C на зиму
0|site.ru/здоровье-4|Здоровье|Здоровье|Взял антибиотики по рецепту врача
0|site.ru/здоровье-5|Здоровье|Здоровье|Купил капли от насморка
0|site.ru/здоровье-6|Здоровье|Здоровье|Зашёл в аптеку за мазью от ушиба
0|site.ru/здоровье-7|Здоровье|Здоровье|Купил сироп от кашля для ребёнка
0|site.ru/здоровье-8|Здоровье|Здоровье|Взял ибупрофен и парацетамол запасом
0|site.ru/здоровье-9|Здоровье|Здоровье|Купил БАД для иммунитета
0|site.ru/здоровье-10|Здоровье|Здоровье|Зашёл в аптеку за пластырями и йодом
0|site.ru/здоровье-11|Здоровье|Здоровье|Купил витамины для беременных
0|site.ru/здоровье-12|Здоровье|Здоровье|Взял омега-3 и магний
0|site.ru/здоровье-13|Здоровье|Здоровье|Купил антигистаминные, сезон аллергии
0|site.ru/здоровье-14|Здоровье|Здоровье|Зашёл за глазными каплями
0|site.ru/здоровье-15|Здоровье|Здоровье|Купил мазь для суставов
0|site.ru/здоровье-16|Здоровье|Здоровье|Взял таблетки от желудка
0|site.ru/здоровье-17|Здоровье|Здоровье|Купил спрей для горла
0|site.ru/здоровье-18|Здоровье|Здоровье|Зашёл в аптеку, набрал разного
0|site.ru/здоровье-19|Здоровье|Здоровье|Купил препараты для профилактики
0|site.ru/здоровье-20|Здоровье|Здоровье|Взял обезболивающее для поездки
0|site.ru/здоровье-21|Здоровье|Здоровье|Купил витамины для волос и ногтей
0|site.ru/здоровье-22|Здоровье|Здоровье|Зашёл за противоаллергическим
0|site.ru/здоровье-23|Здоровье|Здоровье|Купил антисептик и бинты
0|site.ru/здоровье-24|Здоровье|Здоровье|Взял тест на антигены
0|site.ru/здоровье-25|Здоровье|Здоровье|Купил термометр электронный в аптеке
0|site.ru/здоровье-26|Здоровье|Здоровье|Записался к терапевту, платный приём
0|site.ru/здоровье-27|Здоровье|Здоровье|Сходил к стоматологу на чистку зубов
0|site.ru/здоровье-28|Здоровье|Здоровье|Сдал анализы крови в частной клинике
0|site.ru/здоровье-29|Здоровье|Здоровье|Прошёл УЗИ органов брюшной полости
0|site.ru/здоровье-30|Здоровье|Здоровье|Сделал МРТ колена, давно болело
0|site.ru/здоровье-31|Здоровье|Здоровье|Сходил к офтальмологу, проверил зрение
0|site.ru/здоровье-32|Здоровье|Здоровье|Заплатил за приём у хирурга
